HOT,Frits D. van Paasschen,"Chief Executive Officer, President and Director,",Starwood Hotels & Resorts Worldwide Inc.,Harvard Business School,52,9103039,,2007,"Mr. Frits D. van Paasschen has been the President and Chief Executive Officer of Starwood Hotels & Resorts Worldwide Inc. since September 24, 2007. Mr. van Paasschen serves as the Chief Executive Officer and President of Sheraton Hotels & Resorts, Inc. He served as President and Chief Executive Officer of Coors Brewing Company from March 29, 2005 to August 31, 2007. He has over 20 years experience in retail, operations and supply chain, consumer marketing and finance. ... Beginning in 1983, he served in various management positions with Boston Consulting Group, First Call Corporation, Goldman, Sachs & Co. and McKinsey & Company. He served as the Head of U.S. Operations of Molson Coors Brewing Company from March 2005 to September 2007. He served as Corporate Vice President and General Manager of Europe, Middle East and Africa of Nike Inc. from 2000 to 2004. Mr. van Paasschen served as Vice President and General Manager of Canada, Latin America and Africa of Nike Inc. from 1998 to 2000 and served as its Vice President of Global Strategic Planning from 1998. He served as Vice President of Finance & Planning of Disney Consumer Products, The Walt Disney Company since 1995 and was engaged in management and business consulting. He served as Chairman and Nike Representative of the European-American Industrial Council from 2000 to 2004. He has been a Non-Executive Director of Barclays PLC since August 1, 2013. He has been a Director of Barclays Bank PLC since August 1, 2013 and of Starwood Hotels & Resorts Worldwide Inc. since September 24, 2007. Mr. Paasschen served as Director of The Jones Group Inc. since November 30, 2006. He served as Independent Director of Oakley, Inc. from September 2005 to November 2007. Mr. van Paasschen holds a Bachelor of Arts Degree in Economics and Biology from Amherst College in Massachusetts and MBA from Harvard Business School. Beginning in 1983, he served in various management positions with Boston Consulting Group, First Call Corporation, Goldman, Sachs & Co. and McKinsey & Company. He served as the Head of U.S. Operations of Molson Coors Brewing Company from March 2005 to September 2007. He served as Corporate Vice President and General Manager of Europe, Middle East and Africa of Nike Inc. from 2000 to 2004. Mr. van Paasschen served as Vice President and General Manager of Canada, Latin America and Africa of Nike Inc. from 1998 to 2000 and served as its Vice President of Global Strategic Planning from 1998. He served as Vice President of Finance & Planning of Disney Consumer Products, The Walt Disney Company since 1995 and was engaged in management and business consulting. He served as Chairman and Nike Representative of the European-American Industrial Council from 2000 to 2004. He has been a Non-Executive Director of Barclays PLC since August 1, 2013. He has been a Director of Barclays Bank PLC since August 1, 2013 and of Starwood Hotels & Resorts Worldwide Inc. since September 24, 2007. Mr. Paasschen served as Director of The Jones Group Inc. since November 30, 2006. He served as Independent Director of Oakley, Inc. from September 2005 to November 2007. Mr. van Paasschen holds a Bachelor of Arts Degree in Economics and Biology from Amherst College in Massachusetts and MBA from Harvard Business School.","One StarPointStamford, Connecticut 06902United States","Oakley, Inc.|Molson Coors Brewing Company|Nike, Inc.|The Jones Group Inc.|Barclays PLC|Starwood Vacation Ownership, Inc.|Coors Brewing Company, Inc.|Le Mﾒﾩridien Hotels and Resorts Limited|Harvard Business School|Barclays Bank PLC|Amherst College|Sheraton Hotels & Resorts, Inc.",Male,NA,NA,United States of America,,,,,Amherst College,BAchelor of Arts,Harvard University,MBA,,,,,,,,,,,,,,,,,,,,,,,,
STT,Joseph L. Hooley,"Chairman, Chief Executive Officer, President, Chairman of Executive Committee and Member of Risk & Capital Committee,",State Street Corporation,Boston College,56,15629291,,2010,"Mr. Joseph L. Hooley, also known as Jay, has been the Chairman of State Street Corporation since January 1, 2011 as its Chief Executive Officer since March 1, 2010 and also as its President since April 2008. Mr. Hooley served as the Chief Operating Officer of State Street Corporation since April 2008 and also served as its Head of Investment Servicing and Investment Research and Trading since 2002 and Vice Chairman since December 22, 2006. He served as an Executive Vice ... President of State Street Corp. from 2000 to April 2008. He was responsible for State Street Corporation's asset servicing, securities finance and investment research and trading activities worldwide and is a member of State Street's Operating Group. He joined State Street in 1986 in the mutual fund sales organization. He worked for AT&T. He served as Chief Executive Officer of International Financial Data Services (IFDS). From 1988 to 1990, he served as president and chief executive officer of National Financial Data Services. He served as President and Chief Executive Officer of Boston Financial Data Services and International Financial Data Services from 1990 to 2000. He was a major contributor to the successful integration of the Deutsche Bank's Global Securities Services business, acquired in January 2003. He has been Director of State Street Corp. since October 2010. He serves as a Director on the board of Boston Financial Data Services and The Boys and Girls Club of Boston. He serves as Trustee at New England College of Finance. Mr. Hooley received his Bachelor of Science degree from Boston College. President of State Street Corp. from 2000 to April 2008. He was responsible for State Street Corporation's asset servicing, securities finance and investment research and trading activities worldwide and is a member of State Street's Operating Group. He joined State Street in 1986 in the mutual fund sales organization. He worked for AT&T. He served as Chief Executive Officer of International Financial Data Services (IFDS). From 1988 to 1990, he served as president and chief executive officer of National Financial Data Services. He served as President and Chief Executive Officer of Boston Financial Data Services and International Financial Data Services from 1990 to 2000. He was a major contributor to the successful integration of the Deutsche Bank's Global Securities Services business, acquired in January 2003. He has been Director of State Street Corp. since October 2010. He serves as a Director on the board of Boston Financial Data Services and The Boys and Girls Club of Boston. He serves as Trustee at New England College of Finance. Mr. Hooley received his Bachelor of Science degree from Boston College.","State Street Financial CenterBoston, Massachusetts 02111United States",Boston College,Male,NA,NA,United States of America,State Street Corporation - Vice Chair - ts_bot - Employment tenure | ,,,,Boston College,BS,NA,NA,,,,,,,,,,,,,,,,,,,,,,,,
SRCL,Charles A. Alutto,"Chief Executive Officer, President and Director,","Stericycle, Inc.",St. John's University,47,1839905,,2013,"Mr. Charles A. Alutto, also known as Charlie, has been the President and Chief Executive Officer at Stericycle, Inc. since January 1, 2013. Mr. Alutto has been the President of Stericycle USA at Stericycle, Inc. since January 2010 and also served as its Executive Vice President. Mr. Alutto joined Stericycle in May 1997. He joined Stericycle, Inc., in February 2011 as its Executive Officer. He previously held various management positions with us, including Vice President ... and Managing Director of SRCL Europe. He has been a Director of Stericycle, Inc. since November 15, 2012. Mr. Alutto holds a B.S. in Finance from Providence College and a M.B.A. in Finance from St. John���s University. and Managing Director of SRCL Europe. He has been a Director of Stericycle, Inc. since November 15, 2012. Mr. Alutto holds a B.S. in Finance from Providence College and a M.B.A. in Finance from St. John���s University.","28161 North Keith DriveLake Forest, Illinois 60045United States",St. John's University|Providence College,Male,NA,NA,NA,,,,,Providence College,BS Finance,St. John's University,MBA,,,,,,,,,,,,,,,,,,,,,,,,
SYK,Kevin A. Lobo,"Chief Executive Officer, President and Director,",Stryker Corporation,McGill University,48,8436919,,2012,"Mr. Kevin A. Lobo has been the Chief Executive Officer and President of Stryker Lobosince October 1, 2012. Mr. Lobo serves as the President of Stryker Corporation at President of Stryker Corporation. Mr. Lobo is the President of Stryker Orthopedics Inc. He served as the President of Orthovita Inc. since June 27, 2011. He is the Group President of Orthopaedics at Stryker Corporation since June 10, 2011. He was the President of Ethicon Endo-Surgery, a division of Johnson ... & Johnson, from June 2009 to April 2011, as President of Ethicon Endo-Surgery from July 2006 to May 2009 and President of Johnson & Johnson Medical Products from October 2005 to July 2006. He served as President of J&J Medical Products Canada and at McNeil as the Vice President of Finance for Consumer and Specialty Pharmaceuticals and Ortho Women's Health & Urology. He also worked for Rhone-Poulenc in North America and Europe, as well as Kraft and KPMG in Canada. Mr. Lobo served as a Vice President of Finance. Mr. Lobo has been a Director of Stryker Corporation since October 1, 2012 and Parker-Hannifin Corporation since August 1, 2013. Mr. Lobo received his Bachelors degree in Commerce from McGill University and his MBA from the University of Toronto. & Johnson, from June 2009 to April 2011, as President of Ethicon Endo-Surgery from July 2006 to May 2009 and President of Johnson & Johnson Medical Products from October 2005 to July 2006. He served as President of J&J Medical Products Canada and at McNeil as the Vice President of Finance for Consumer and Specialty Pharmaceuticals and Ortho Women's Health & Urology. He also worked for Rhone-Poulenc in North America and Europe, as well as Kraft and KPMG in Canada. Mr. Lobo served as a Vice President of Finance. Mr. Lobo has been a Director of Stryker Corporation since October 1, 2012 and Parker-Hannifin Corporation since August 1, 2013. Mr. Lobo received his Bachelors degree in Commerce from McGill University and his MBA from the University of Toronto.","2825 Airview BoulevardKalamazoo, Michigan 49002United States",Orthovita Inc.|Howmedica Osteonics Corporation|Parker-Hannifin Corporation|University of Toronto|McGill University,Male,NA,NA,NA,,,,,McGill University,BS,University of Toronto,MBA,,,,,,,,,,,,,,,,,,,,,,,,
STI,William Henry Rogers Jr.,"Chairman, Chief Executive Officer, President and Chairman of Executive Committee,","SunTrust Banks, Inc.",University Of North Carolina At Chapel Hill,55,5943602,,2011,"Mr. William Henry Rogers, Jr., also known as Bill, has been the Chief Executive Officer and President of SunTrust Banks, Inc. since June 2011 and December 12, 2008 respectively. Mr. Rogers served as the Chief Operating Officer at SunTrust Banks, Inc. from November 9, 2010 to June 2011. Prior to that, he served as the Corporate Executive Vice President of SunTrust Banks, Inc. until December 2008. He has the responsibility for trust, investment, and private client services ... in the firm. Mr. Rogers has held various other positions with SunTrust since 1980. Prior to October 2000, he was the Head of Georgia community banking and the Georgia retail line of business. He has been the Chairman at SunTrust Banks, Inc. since January 1, 2012. Mr. Rogers has been a Director of SunTrust Banks since June 1, 2011. He serves as a Director at RidgeWorth Capital Management, Inc. He has been a Director of Federal Reserve Bank of Atlanta since January 1, 2012. He also serves as a Director of SunTrust Capital Markets and Trusco Capital Management, Inc. He served as a Director of Books-A-Million, Inc. since November 2000 until May 28, 2013. He holds an MBA from Georgia State University and a bachelor of science in business administration from the University of North Carolina at Chapel Hill. in the firm. Mr. Rogers has held various other positions with SunTrust since 1980. Prior to October 2000, he was the Head of Georgia community banking and the Georgia retail line of business. He has been the Chairman at SunTrust Banks, Inc. since January 1, 2012. Mr. Rogers has been a Director of SunTrust Banks since June 1, 2011. He serves as a Director at RidgeWorth Capital Management, Inc. He has been a Director of Federal Reserve Bank of Atlanta since January 1, 2012. He also serves as a Director of SunTrust Capital Markets and Trusco Capital Management, Inc. He served as a Director of Books-A-Million, Inc. since November 2000 until May 28, 2013. He holds an MBA from Georgia State University and a bachelor of science in business administration from the University of North Carolina at Chapel Hill.","303 Peachtree Street, N.E.Atlanta, Georgia 30308United States","Books-A-Million Inc.|University Of North Carolina At Chapel Hill|RidgeWorth Capital Management, Inc.|Georgia State University|Federal Reserve Bank of Atlanta",Male,NA,NA,NA,,,,,University of North Carolina at Chapel Hill,BBA,Georgia State University,MBA,,,,,,,,,,,,,,,,,,,,,,,,
SYMC,Stephen M. Bennett,"Chief Executive Officer, President and Director,",Symantec Corporation,University of Wisconsin - Madison,59,12996588,,2012,"Mr. Stephen M. Bennett, also known as Steve, has been the Chief Executive Officer and President of Symantec Corporation since July 2012. Mr. Bennett serves as an Advisor of Sojern Inc. He served as the Chairman, Chief Executive Officer, President of Intuit Inc. from January 2000 to January 2008 and also served as its Consultant from December 2007 to July 2008. He joined Intuit Inc. in January 2000. Mr. Bennett has combined historic innovative and customer-driven expertise ... with strategic and operational rigor, taking Intuit beyond the billion-dollar revenue threshold. He has more than 30 years of financial and business expertise. He served as an Acting Senior Vice President of Consumer Tax Group at Intuit Inc., since January 5, 2004. He served 23-years at GE. Mr. Bennett served as the Chief Executive Officer at Orbitz, SwissAir and of Alta Vista. From July 1999 to November 1999, he served as the Chief Executive Officer and President at GE Capital e-Business. He served as the Chief Executive Officer and President at GE Capital Vendor Financial Services Business from April 1996 to June 1999. He served as an Executive Vice President and Member of the office of the Chief Executive Officer at GE Capital from December 1999 to January 2000, where he was responsible for portfolio of five different companies. He served as Vice President of Americas for GE Electrical Distribution and Control, and served a variety of key management roles in numerous areas of GE's business, including GE Appliances, GE Medical and GE Supply. He serves as the Chairman of the Deans Advisory Board for the University of Wisconsin Business School. He served as the Chairman of Symantec Corporation from October 25, 2011 to January 23, 2013. He served as the Chairman of Nemean Networks, LLC. He has been a Director of Qualcomm Inc. since August 2008. He has been a Director of American Airlines Group Inc. and American Airlines Inc. since July 19, 2011. He has been a Director of Symantec Corporation since February 8, 2010. He has been a Director of Oracle America Inc. since June 28, 2004. He served as a Director of Sojern, Inc. since August 2008. He served as a Director of Intuit Inc. from January 2000 to December 2009 and GE Capital. He served as a Director of Vertafore, Inc., since 2011. Mr. Bennett holds a Bachelors Degree in Finance and Real Estate from Concordia University of Wisconsin. with strategic and operational rigor, taking Intuit beyond the billion-dollar revenue threshold. He has more than 30 years of financial and business expertise. He served as an Acting Senior Vice President of Consumer Tax Group at Intuit Inc., since January 5, 2004. He served 23-years at GE. Mr. Bennett served as the Chief Executive Officer at Orbitz, SwissAir and of Alta Vista. From July 1999 to November 1999, he served as the Chief Executive Officer and President at GE Capital e-Business. He served as the Chief Executive Officer and President at GE Capital Vendor Financial Services Business from April 1996 to June 1999. He served as an Executive Vice President and Member of the office of the Chief Executive Officer at GE Capital from December 1999 to January 2000, where he was responsible for portfolio of five different companies. He served as Vice President of Americas for GE Electrical Distribution and Control, and served a variety of key management roles in numerous areas of GE's business, including GE Appliances, GE Medical and GE Supply. He serves as the Chairman of the Deans Advisory Board for the University of Wisconsin Business School. He served as the Chairman of Symantec Corporation from October 25, 2011 to January 23, 2013. He served as the Chairman of Nemean Networks, LLC. He has been a Director of Qualcomm Inc. since August 2008. He has been a Director of American Airlines Group Inc. and American Airlines Inc. since July 19, 2011. He has been a Director of Symantec Corporation since February 8, 2010. He has been a Director of Oracle America Inc. since June 28, 2004. He served as a Director of Sojern, Inc. since August 2008. He served as a Director of Intuit Inc. from January 2000 to December 2009 and GE Capital. He served as a Director of Vertafore, Inc., since 2011. Mr. Bennett holds a Bachelors Degree in Finance and Real Estate from Concordia University of Wisconsin.","350 Ellis StreetMountain View, California 94043United States","Intuit Inc.|QUALCOMM Incorporated|Oracle America, Inc.|Internet Patents Corporation|American Airlines Group Inc.|University of Wisconsin - Madison|American Airlines, Inc.|Vertafore, Inc.|Sojern Inc.|Nemean Networks, LLC",Male,NA,NA,NA,,,,,University Of Wisconsin,Real Estate and Finance,NA,NA,,,,,,,,,,,,,,,,,,,,,,,,
SYY,William J. DeLaney III,"Chief Executive Officer, President, Director, Member of Executive Committee and Member of Finance Committee,",Sysco Corporation,University of Notre Dame,57,10885989,,2009,"Mr. William J. DeLaney, III, also known as Bill, has been the Chief Executive Officer of Sysco Corporation since March 2009 and has also been its President since February 5, 2010. Mr. DeLaney served as the Chief Financial Officer and Executive Vice President at Sysco Corp. from July 1, 2007 to October 2009. He served as Senior Vice President of Financial Reporting of Sysco Corp. since January 7, 2007. He served as the President and Chief Executive Officer of SYSCO Charlotte, ... LLC since 2002. He served as an Executive Vice President of the Syracuse operation. Mr. Delaney started his career with SYSCO in 1987 as an Assistant Treasurer at corporate headquarters in Houston, Texas. Since 1991, he served as a Treasurer of SYSCO and Vice President from 1993 to 1994. He joined SYSCO Charlotte in 1996 as a Chief Financial Officer and served as its Senior Vice President since 1998. He has experience in the areas of accounting, finance, operations and management. Throughout his career, he has developed experience and knowledge in the areas of leadership and management development, corporate strategy and development, finance and accounting and distribution and supply chain management. He has extensive experience as a corporate executive officer. Mr. Delaney has been an Independent Director of Aristotle Holding, Inc. since September 2011. He serves as a Director of Express Scripts, Inc., The Center for Houston���s Future and the Greater Houston Partnership. He has been a Director of Express Scripts Holding Company since September 28, 2011 and Sysco Corp. since January 2009. Mr. Delaney holds a Bachelor of Business Administration from the University of Notre Dame, located in South Bend, Ind., in 1977 and Master of Business Administration from the Wharton Graduate Division of the University of Pennsylvania in 1982. LLC since 2002. He served as an Executive Vice President of the Syracuse operation. Mr. Delaney started his career with SYSCO in 1987 as an Assistant Treasurer at corporate headquarters in Houston, Texas. Since 1991, he served as a Treasurer of SYSCO and Vice President from 1993 to 1994. He joined SYSCO Charlotte in 1996 as a Chief Financial Officer and served as its Senior Vice President since 1998. He has experience in the areas of accounting, finance, operations and management. Throughout his career, he has developed experience and knowledge in the areas of leadership and management development, corporate strategy and development, finance and accounting and distribution and supply chain management. He has extensive experience as a corporate executive officer. Mr. Delaney has been an Independent Director of Aristotle Holding, Inc. since September 2011. He serves as a Director of Express Scripts, Inc., The Center for Houston���s Future and the Greater Houston Partnership. He has been a Director of Express Scripts Holding Company since September 28, 2011 and Sysco Corp. since January 2009. Mr. Delaney holds a Bachelor of Business Administration from the University of Notre Dame, located in South Bend, Ind., in 1977 and Master of Business Administration from the Wharton Graduate Division of the University of Pennsylvania in 1982.","1390 Enclave ParkwayHouston, Texas 77077United States","Express Scripts Holding Company|University of Notre Dame|University of Pennsylvania - The Wharton School|Sysco Charlotte, LLC|Express Scripts, Inc.",Male,NA,NA,NA,"Sysco - 2007-07-01 - Executive Vice President and Chief Financial Officer - tina526 - Employment tenure | Sysco - 2006-12 - Senior Vice President, Financial Reporting - tina526 - Employment tenure | Sysco - 2004 - President and Chief Executive Officer, Charlotte Operation - 2006 - tina526 - Employment tenure | Sysco - 2002 - Executive Vice President, Syracuse Operation - tina526 - Employment tenure | Sysco - 1998 - Senior Vice President, Syracuse Operation - ts_bot - Employment tenure | Sysco - 1996 - Chief Financial Officer, Syracuse Operation - tina526 - Employment tenure | Sysco - 1993 - Vice President - 1994 - tina526 - Employment tenure | Sysco - 1991 - Treasurer - tina526 - Employment tenure | Sysco - 1987 - Assistant Treasurer - tina526 - Employment tenure | ",,,,University of Notre Dame,NA,Wharton School of University,MBA,,,,,,,,,,,,,,,,,,,,,,,,
