CRM,Marc   Benioff,"Co-Founder, Chairman and Chief Executive Officer,","Salesforce.com, Inc",University of Southern California,48,22100904,,2001,"Mr. Marc Benioff co-founded Salesforce.com, Inc., in February 1999. Mr. Benioff has been the Chief Executive Officer of Salesforce.com, Inc. since November 2001 and has been its Chairman since February 1999. Mr. Benioff serves as a General Advisor of Keas Inc. From 1986 to 1999, Mr. Benioff was employed at Oracle Corporation where he held a number of positions in sales, marketing and product development, served as its Senior Vice President. For the 13 years prior to ... his service at salesforce.com. He was employed by Nextera Enterprises Inc. He serves as Member of Executive Council at TechNet. He has been a Director of salesforce.com Inc. since 1999 and Cisco Systems, Inc. since August 1, 2012. He has been a Director of DW Data, Inc. since August 1999. He serves as a Director at Notifi.com, Committee Encouraging Corporate Philanthropy and Yield Dynamics. He serves as Director of Cloudwords, Inc. He serves as a Member of Board of Advisors at Loyalty Lab Inc. Mr. Benioff served as a of Member the Board of Directors at GrandCentral Communications, Inc. He serves as Co-Chairman of President of the United States' Information Technology Advisory Committee (PITAC). He serves as the Chairman of salesforce.com/foundation. He holds a Bachelor of Science in Business Administration (B.S.B.A.) from University of Southern California. his service at salesforce.com. He was employed by Nextera Enterprises Inc. He serves as Member of Executive Council at TechNet. He has been a Director of salesforce.com Inc. since 1999 and Cisco Systems, Inc. since August 1, 2012. He has been a Director of DW Data, Inc. since August 1999. He serves as a Director at Notifi.com, Committee Encouraging Corporate Philanthropy and Yield Dynamics. He serves as Director of Cloudwords, Inc. He serves as a Member of Board of Advisors at Loyalty Lab Inc. Mr. Benioff served as a of Member the Board of Directors at GrandCentral Communications, Inc. He serves as Co-Chairman of President of the United States' Information Technology Advisory Committee (PITAC). He serves as the Chairman of salesforce.com/foundation. He holds a Bachelor of Science in Business Administration (B.S.B.A.) from University of Southern California.","The Landmark @ One MarketSan Francisco, California 94105United States","Cisco Systems, Inc.|Oracle Corporation|DW Data, Inc.|Nextera Enterprises Inc.|University of Southern California|TechNet|GrandCentral Communications, Inc.|Loyalty Lab, Inc.|Keas Inc.|Committee Encouraging Corporate Philanthropy|Cloudwords, Inc.",Male,25/9/64,Binghamton,United States of America | ,Salesforce.com - 1999 - Chief Executive Officer - 2007 - tbarker - Employment tenure | Salesforce.com - Chairman - ts_bot - Employment tenure | Oracle Corporation - Freebase Data Team - Employment tenure | ,,,,Bachelor of Arts/Science,,,,,,,,,,,,,,,,,,,,,,,,,,,
SNDK,Sanjay   Mehrotra,"Co-Founder, Chief Executive Officer, President, Director and Member of Special Option Committee,",SanDisk Corp.,University of California Berkeley,54,6666236,,2011,"Mr. Sanjay Mehrotra Co-Founded SanDisk Corp., in 1988 and has been its Chief Executive Officer since January 1, 2011 and President since June 2006. Mr. Mehrotra serves as the Chief Executive Officer and President at Cavium Networks Inc. Mr. Mehrotra serves as the Chief Operating Officer of SanDisk Limited. Mr. Mehrotra co-founded SanDisk in 1988 and served as its Vice President of Engineering, Vice President of Product Development, Director of Memory Design, and Product ... Engineering. He served as the Chief Operating Officer of SanDisk Corp. since 2001. He served as an Executive Vice President of SanDisk Corp. He has more than 29 years of experience in the non-volatile semiconductor memory industry including engineering and engineering management positions at Intel Corporation, Seeq Technology, Integrated Device Technology and Atmel Corporation. He has been a Director of SanDisk Corp. since July 21, 2010. He has been a Director at Cavium Networks, Inc. since July 2009. Mr. Mehrotra serves as a board member of Divio. He serves on the Engineering Advisory Board of the University of California, Berkeley. He holds several patents and has published articles in the area of non-volatile memory design and flash memory systems. Mr. Mehrotra received a B.S. and an M.S. degrees in Electrical Engineering and computer sciences from the University of California, Berkeley. Engineering. He served as the Chief Operating Officer of SanDisk Corp. since 2001. He served as an Executive Vice President of SanDisk Corp. He has more than 29 years of experience in the non-volatile semiconductor memory industry including engineering and engineering management positions at Intel Corporation, Seeq Technology, Integrated Device Technology and Atmel Corporation. He has been a Director of SanDisk Corp. since July 21, 2010. He has been a Director at Cavium Networks, Inc. since July 2009. Mr. Mehrotra serves as a board member of Divio. He serves on the Engineering Advisory Board of the University of California, Berkeley. He holds several patents and has published articles in the area of non-volatile memory design and flash memory systems. Mr. Mehrotra received a B.S. and an M.S. degrees in Electrical Engineering and computer sciences from the University of California, Berkeley.","951 SanDisk DriveMilpitas, California 95035United States","Cavium, Inc.|SanDisk Limited|University of California Berkeley",Male,N/A,N/A,United States of America | India | ,SanDisk - President and Chief Operating Officer - piston6honda - Employment tenure | SanDisk - Executive Vice President - ts_bot - Employment tenure | SanDisk - Chief Operating Officer - ts_bot - Employment tenure | ,,,,Bachelor of Science,Electrical Engineering,"University of California, Berkeley",Computer Science,,,,,,,,,,,,,,,,,,,,,,,,
SCG,Kevin B. Marsh,"Chairman, Chief Executive Officer, President, Chief Operating Officer, Chairman of Executive Committee, Chairman of South Carolina Electric & Gas Company, Chief Executive Officer of South Carolina Electric & Gas Company and Director of South Carolina Electric & Gas Company ,",SCANA Corp.,University of Georgia,57,5234487,,2011,"Mr. Kevin B. Marsh has been Chief Executive Officer of SCANA Corp. since November 30, 2011. Mr. Marsh has been Chairman and Chief Executive Officer of South Carolina Electric & Gas Co. since 2011. He has been the President and Chief Operating Officer of SCANA Corp. since January 7, 2011. Mr. Marsh served as the President of South Carolina Electric & Gas Co. since May 15, 2006 until 2011. He served as Chief Operating Officer of South Carolina Electric & Gas Co. since ... May 15, 2006 until 2011. He served as the President and Chief Operating Officer of Public Service Company of North Carolina Inc. (Formerly PSNC Energy) since April 2006. He served as the Chief Financial Officer and Senior Vice President of South Carolina Electric & Gas Co. (SCE&G) until May 15, 2006. He joined South Carolina Electric & Gas Co. in 1984 as Group Manager of technical accounting and served as its Vice President and Controller since 1989. He served as Vice President of Corporate Planning of SCE&G. He served as a Senior Vice President of Finance and Chief Financial Officer of SCANA Corp. from 1998 to 2006. Mr. Marsh served as Vice President of Finance and Chief Financial Officer of SCANA from 1996 to 1998 and as its Controller from March 1, 1998 to 2000. Mr. Marsh served as President and Chief Operating Officer of PSNC Energy from October 2001 to March 2003 and Previously served as its Vice President of Finance and Chief Financial Officer from 1996 to 1998 and Vice President of Finance from 1992 to 1996. He began his career with Deloitte & Touche in Columbia in 1977. He has been the Chairman of SCANA Corp, since November 30, 2011. He has been a Director at First Citizens Bancorp., Inc. (Formerly First Citizens Bancorporation of South Carolina Inc.) since January 2004 and SCANA Corp., since January 2011. He serves as a Director of First Citizens Bank and the Business Development Corporation of South Carolina. He served as past board member of Palmetto Place Children's Emergency Shelter. Mr. Marsh is a Member of the American Institute of Certified Public Accountants. Mr. Marsh earned a BS in accounting at the University of Georgia in Athens. May 15, 2006 until 2011. He served as the President and Chief Operating Officer of Public Service Company of North Carolina Inc. (Formerly PSNC Energy) since April 2006. He served as the Chief Financial Officer and Senior Vice President of South Carolina Electric & Gas Co. (SCE&G) until May 15, 2006. He joined South Carolina Electric & Gas Co. in 1984 as Group Manager of technical accounting and served as its Vice President and Controller since 1989. He served as Vice President of Corporate Planning of SCE&G. He served as a Senior Vice President of Finance and Chief Financial Officer of SCANA Corp. from 1998 to 2006. Mr. Marsh served as Vice President of Finance and Chief Financial Officer of SCANA from 1996 to 1998 and as its Controller from March 1, 1998 to 2000. Mr. Marsh served as President and Chief Operating Officer of PSNC Energy from October 2001 to March 2003 and Previously served as its Vice President of Finance and Chief Financial Officer from 1996 to 1998 and Vice President of Finance from 1992 to 1996. He began his career with Deloitte & Touche in Columbia in 1977. He has been the Chairman of SCANA Corp, since November 30, 2011. He has been a Director at First Citizens Bancorp., Inc. (Formerly First Citizens Bancorporation of South Carolina Inc.) since January 2004 and SCANA Corp., since January 2011. He serves as a Director of First Citizens Bank and the Business Development Corporation of South Carolina. He served as past board member of Palmetto Place Children's Emergency Shelter. Mr. Marsh is a Member of the American Institute of Certified Public Accountants. Mr. Marsh earned a BS in accounting at the University of Georgia in Athens.","100 Scana ParkwayCayce, South Carolina 29033United States","Public Service Company of North Carolina, Incorporated|First Citizens Bancorp., Inc.|South Carolina Electric & Gas Company|University of Georgia",Male,N/A,N/A,United States of America | ,SCANA - Chief Operating Officer - ts_bot - Employment tenure | SCANA - President - ts_bot - Employment tenure | ,,,,NA,N/A,NA,N/A,,,,,,,,,,,,,,,,,,,,,,,,
SLB,Paal   Kibsgaard,"Chief Executive Officer and Director,",Schlumberger Limited,Norwegian University of Science and Technology,45,22837540,,2011,"Mr. Paal Kibsgaard has been Chief Executive Officer of Schlumberger Ltd. since August 01, 2011. Mr. Kibsgaard served as the Chief Operating Officer of Schlumberger Ltd. from February 2010 to July 2011 and also served as its Group President of Reservoir Characterization since May 2009 and as Vice President of Personnel from April 2006 to November 2007. Mr. Kibsgaard served as President of Drilling & Measurements of Schlumberger Oilfield Services - Technologies (OFS) of ... Schlumberger Ltd., since February 2003. Mr. Kibsgaard was responsible for setting goals, direction and policies as well as managing the performance of this division within the Schlumberger Technology Corporation. Mr. Kibsgaard served as the Wireline open hole business development manager based in Paris, responsible for product development and market introduction of new technology. In his previous position, Mr. Kibsgaard was the OFS Geomarket manager for the Caspian Geomarket (CAG). Based in Atyrau, Kazakhstan, he was responsible for setting up the CAG Geomarket structure and positioning all the Schlumberger Oilfield Services segments for the exciting future of Caspian Oil and Gas exploration and development activity. His earlier assignments included OFS Marketing in Paris and Wireline marketing manager in Scandinavia, based in Stavanger. He joined Schlumberger as an ID reservoir engineer in Saudi Arabia in 1997. Prior to this, Mr. Kibsgaard worked for ExxonMobil, with postings in Norway and Australia. He has been a Director of Schlumberger Ltd. since April 6, 2011. He holds a Master's degree in Petroleum Engineering from the Norwegian Institute of Technology, Trondheim. Schlumberger Ltd., since February 2003. Mr. Kibsgaard was responsible for setting goals, direction and policies as well as managing the performance of this division within the Schlumberger Technology Corporation. Mr. Kibsgaard served as the Wireline open hole business development manager based in Paris, responsible for product development and market introduction of new technology. In his previous position, Mr. Kibsgaard was the OFS Geomarket manager for the Caspian Geomarket (CAG). Based in Atyrau, Kazakhstan, he was responsible for setting up the CAG Geomarket structure and positioning all the Schlumberger Oilfield Services segments for the exciting future of Caspian Oil and Gas exploration and development activity. His earlier assignments included OFS Marketing in Paris and Wireline marketing manager in Scandinavia, based in Stavanger. He joined Schlumberger as an ID reservoir engineer in Saudi Arabia in 1997. Prior to this, Mr. Kibsgaard worked for ExxonMobil, with postings in Norway and Australia. He has been a Director of Schlumberger Ltd. since April 6, 2011. He holds a Master's degree in Petroleum Engineering from the Norwegian Institute of Technology, Trondheim.","5599 San FelipeHouston, Texas 77056United States",Norwegian University of Science and Technology,Male,N/A,N/A,N/A,Schlumberger - Vice President - ts_bot - Employment tenure | ,,,,NA,N/A,NA,N/A,,,,,,,,,,,,,,,,,,,,,,,,
SCHW,Walter W. Bettinger II,"Chief Executive Officer, President, Director and Member of Policy Committee,",The Charles Schwab Corporation,Ohio University,53,12726488,,2008,"Mr. Walter W. Bettinger, II, has been the President and Chief Executive Officer of The Charles Schwab Corporation since February 21, 2007 and October 2008, respectively. Mr. Bettinger serves as the Chief Executive Officer and President of Charles Schwab & Co., Inc. Mr. Bettinger served as the Head of Schwab Investor Services of Charles Schwab Corp. and served as its Chief Operating Officer from February 21, 2007 to October 2008. He served as the President of Individual ... Investor Enterprise - Schwab of Charles Schwab Corp. since November 2005. Mr. Bettinger served as an Executive Vice President of The Charles Schwab Corporation (CSC) from June 2004 to February 21, 2007. From 2004 to 2007, he served as an Executive Vice President and President, Schwab Investor Services. He served as Chief Operating Officer of The Charles Schwab Corporation until October 2008. He served as Executive Vice President of Individual Investor Enterprise from 2004 to 2005 and served as its Executive Vice President, Corporate Services from 2002 to 2004. He served as the President and Chief Operating Officer of Individual Investor Enterprise - Schwab of Charles Schwab & Co. Inc. (Schwab) from June 2004 to October 2008. Mr. Bettinger served as an Executive Vice President and President of Corporate Services of Schwab from 2002 to June 2004. He served as an Executive Vice President and President of Retirement Plan Services of Schwab from 2000 to 2002 and a General Manager of SchwabPlan 401(k) product offering. He served as the Chief Operating Officer of Retirement Plan Services enterprise. He joined Schwab in 1995. He founded Hampton Company in 1983. He served as the Chairman of the board, President and Chief Executive Officer of Charles Schwab Trust Company from 2000 to 2004. He has been a Director of Charles Schwab Corp. since October 2008 and Charles Schwab Bank since 2006. He has been a Director of Charles Schwab & Co., Inc. since May 2008. He served as a Trustee of various portfolios in the fund complex of Schwab Capital Trust and 86 funds in Laudus funds complex. He served as a Director of Securities Industry and Financial Markets Association. He serves as a Member of Executive Advisory Board of the Ohio University of School of Business. He was named the Impact Player of the Year"" among bundled 401(k) executives by Defined Contribution News in 2002. He is a Certified Pension Consultant (CPC) and Qualified Pension Administrator (QPA) by the American Society of Pension Actuaries. Mr. Bettinger is a summa cum laude graduate of Ohio University with a degree in Finance and Investments. He also completed the General Management program offered by the Harvard Business School. Investor Enterprise - Schwab of Charles Schwab Corp. since November 2005. Mr. Bettinger served as an Executive Vice President of The Charles Schwab Corporation (CSC) from June 2004 to February 21", 2007. From 2004 to 2007, he served as an Executive Vice President and President, Schwab Investor Services. He served as Chief Operating Officer of The Charles Schwab Corporation until October 2008. He served as Executive Vice President of Individual Investor Enterprise from 2004 to 2005 and served as its Executive Vice President, Corporate Services from 2002 to 2004. He served as the President and Chief Operating Officer of Individual Investor Enterprise - Schwab of Charles Schwab & Co. Inc. (Schwab) from June 2004 to October 2008. Mr. Bettinger served as an Executive Vice President and President of Corporate Services of Schwab from 2002 to June 2004. He served as an Executive Vice President and President of Retirement Plan Services of Schwab from 2000 to 2002 and a General Manager of SchwabPlan 401(k) product offering. He served as the Chief Operating Officer of Retirement Plan Services enterprise. He joined Schwab in 1995. He founded Hampton Company in 1983. He served as the Chairman of the board, President and Chief Executive Officer of Charles Schwab Trust Company from 2000 to 2004. He has been a Director of Charles Schwab Corp. since October 2008 and Charles Schwab Bank since 2006. He has been a Director of Charles Schwab & Co.," Inc. since May 2008. He served as a Trustee of various portfolios in the fund complex of Schwab Capital Trust and 86 funds in Laudus funds complex. He served as a Director of Securities Industry and Financial Markets Association. He serves as a Member of Executive Advisory Board of the Ohio University of School of Business. He was named the ""Impact Player of the Year"" among bundled 401(k) executives by Defined Contribution News in 2002. He is a Certified Pension Consultant (CPC) and Qualified Pension Administrator (QPA) by the American Society of Pension Actuaries. Mr. Bettinger is a summa cum laude graduate of Ohio University with a degree in Finance and Investments. He also completed the General Management program offered by the Harvard Business School.""","211 Main StreetSan Francisco, California 94105United States",Harvard Business School|Ohio University|Laudus Trust - Laudus Rosenberg International Small Capitalization Fund|Schwab Capital Trust - Laudus International MarketMasters Fund|Schwab Capital Trust - Schwab Total Stock Market Index Fund|Laudus Rosenberg U.S. Discovery Fund|Schwab Investments - Schwab 1000 Index Fund|Laudus Trust - Laudus Rosenberg International Equity Fund|Schwab Capital Trust - Schwab S&P 500 Index Fund|Schwab Capital Trust - Schwab MarketTrack Conservative Portfolio|Schwab Capital Trust - Schwab Core Equity Fund|Schwab Capital Trust - Schwab Financial Services Fund|Schwab Capital Trust - Small-Cap Equity Fund|Schwab Capital Trust - Schwab Small-Cap Index Fund|Schwab Capital Trust - Schwab International Index Fund|Schwab Capital Trust - Schwab MarketTrack Balanced Portfolio|Schwab Capital Trust - Schwab MarketTrack Growth Portfolio|Schwab Capital Trust - Schwab Hedged Equity Fund|The Laudus Trust - Laudus Rosenberg U.S. Large Capitalization Fund|Schwab Capital Trust - Schwab Health Care Fund|Laudus Trust - Laudus Rosenberg U.S. Small Capitalization Fund|Schwab Capital Trust - Schwab Dividend Equity Fund|Schwab Capital Trust - Schwab Balanced Fund|Laudus MarketMasters Funds - Laudus Small-Cap Marketmasters Fund|Laudus Trust - Laudus U.S. Large Cap Growth Fund|Schwab Capital Trust - Schwab Target 2010 Fund|Schwab Capital Trust - Schwab Target 2020 Fund|Schwab Capital Trust - Schwab Target 2030 Fund|Schwab Capital Trust - Schwab Target 2040 Fund|Schwab Capital Trust - Schwab MarketTrack All Equity Portfolio|Schwab Investments - Schwab YieldPlus Fund|Schwab Investments - Schwab Global Real Estate Fund|Schwab Capital Trust - Schwab Premier Equity Fund|Schwab Capital Trust - Schwab Fundamental U.S. Large Company Index Fund|Laudus Trust - Laudus Mondrian Emerging Markets Fund|Laudus Trust - Laudus Mondrian International Equity Fund|Laudus Institutional Trust - Laudus Mondrian Institutional Emerging Markets Fund|Laudus Trust - Laudus Mondrian Global Equity Fund|Laudus Trust - Laudus Rosenberg International Discovery Fund|Schwab Capital Trust - Schwab Fundamental International Small Company Index Fund|Schwab Capital Trust - Schwab Fundamental Emerging Markets Large Company Index Fund|Schwab Capital Trust - Schwab International Core Equity Fund|Schwab Capital Trust - Schwab Fundamental International Large Company Index Fund|Schwab Capital Trust - Schwab Fundamental U.S. Small-Mid Company Index Fund|Schwab Investments - Schwab Short-Term Bond Market Fund|Schwab Investments - Schwab Tax-Free Bond Fund|Schwab Investments - Schwab Total Bond Market Fund|Schwab Investments - Schwab Intermediate-Term Bond Fund|Schwab Investments - Schwab Treasury Inflation Protected Securities Index Fund|Schwab Investments - Schwab California Tax-Free YieldPlus Fund|Schwab Investments - Schwab Tax-Free YieldPlus Fund|Schwab Investments - Schwab GNMA Fund|Laudus Trust - Laudus Mondrian International Fixed Income Fund|Schwab Capital Trust - Schwab Target 2035 Fund|Schwab Capital Trust - Schwab Target 2025 Fund|Schwab Capital Trust - Schwab Target 2015 Fund|Schwab Capital Trust: Schwab Monthly Income Fund - Maximum Payout|Schwab Capital Trust: Schwab Monthly Income Fund - Enhanced Payout|Schwab Capital Trust: Schwab Monthly Income Fund - Moderate Payout,,,NA,N/A,NA,N/A,,,,,,,,,,,,,,,,,,,,,,,,
SNI,Kenneth W. Lowe,"Chairman, Chief Executive Officer, President and Chairman of Executive Committee,","Scripps Networks Interactive, Inc.",University of North Carolina,62,7236838,,2008,"Mr. Kenneth W. Lowe, also known as Ken, has been the Chairman of the Board, Chief Executive Officer and President of Scripps Networks Interactive, Inc. since July 2008. Mr. Lowe serves as At-Large Programmer Director at National Cable & Telecommunications Association. He served as the Chief Executive Officer of Shopzilla, Inc. He served as the Chief Executive Officer and President at The E. W. Scripps Company until July 1, 2008. He serves as a Director Emeritus of Fifth ... Third BanCorp and served as its Director since January 2004. He served as a Director of Fifth Third Bank. He served as a Director of The Associated Press. He served as a Director of The E. W. Scripps Company from January 2000 to July 1, 2008. Third BanCorp and served as its Director since January 2004. He served as a Director of Fifth Third Bank. He served as a Director of The Associated Press. He served as a Director of The E. W. Scripps Company from January 2000 to July 1, 2008.","9721 Sherrill BoulevardKnoxville, Tennessee 37932United States","The E. W. Scripps Company|Shopzilla, Inc.|Fifth Third Bancorp|University Of North Carolina At Chapel Hill|The Associated Press, Inc.|Fifth Third Bank|National Cable & Telecommunications Association",Male,N/A,N/A,N/A,,,,,NA,N/A,NA,N/A,,,,,,,,,,,,,,,,,,,,,,,,
