VMC,Donald M. James,"Chairman, Chief Executive Officer and Chairman of Executive Committee,",Vulcan Materials Company,University of Virginia,65,7613488,,1997,"Mr. Donald M. James, also known as Don, has been Chairman and Chief Executive Officer of Vulcan Materials Company since May 1997. Mr. James served as the President of Vulcan Materials Co. He has been a Director of Protective Life Corp., since 1997; Southern Company since 1999; Wachovia Corp. since November 1, 2004 and Vulcan Materials Co. since 1996. He has been a Director of Wells Fargo & Co. since January 2009. He served as a Director of SouthTrust Corp. since December ... 16, 1998. 16, 1998.","1200 Urban Center DriveBirmingham, Alabama 35242United States","Southern Company|Wachovia Corporation|Protective Life Corporation|Wells Fargo & Company|SouthTrust Corp.|University of Virginia|University Of Alabama|Birmingham-Southern College|University of Virginia School of Law|Vulcan Materials Company, Pension Arm|UAB Health System|Legacy Vulcan Corp.|Vulcan Construction Materials, LLC",Male,20/1/49,NA,NA,Vulcan Materials Company - 1997-05 - Chief Executive Officer - ts_bot - Employment tenure | ,,,,University of Virginia,LLB,University Of Alabama,MBA,,,,,,,,,,,,,,,,,,,,,,,,
WMT,C. Douglas McMillon,"Chief Executive Officer, President and Director,",Wal-Mart Stores Inc.,University of Arkansas - Fayetteville,47,9563093,,2014,"Mr. C. Douglas McMillon, also known as Doug, has been the Chief Executive Officer and President of Wal-Mart Stores Inc. since February 1, 2014. Mr. McMillon served as the President and Chief Executive Officer of Wal-Mart International Operations at Wal-Mart Stores from February 1, 2009 to February 1, 2014. He served as an Executive Vice President of Wal-Mart Stores Inc. since August 4, 2005. He served as the Chief Executive Officer and President of SAM'S West, Inc., ... (alternate name Sam's Club) from August 4, 2005 to April 3, 2009. He was responsible for the overall corporate strategy and direction of Sam's Club. Mr. McMillon served as an Executive Vice President of Merchandising and Replenishment of Sam's Club of Wal Mart Stores Inc. until August 2005. He worked two consecutive summers as an Associate at the Wal-Mart Distribution Centers in Northwest Arkansas. He served as a Buyer Trainee for Wal-Mart working in Store #894 in Tulsa, OK. Mr. McMillon served as a Buyer for Food and Candy, Ladieswear and Crafts, a Divisional Merchandise Manager for Home Furnishings and Infants and Toddlers, Vice President and General Merchandise Manager at Sam���s Club International and Senior Vice President and General Merchandise Manager at Wal-Mart Stores Inc. oversaw purchases for Toys, Electronics, Video Games, Photo, Sporting Goods, Stationary and Office Supplies. Mr. McMillon serves as a Director of National Chapter of Students in Free Enterprise (SIFE). He has been a Director of Wal-Mart Stores Inc. since November 2013 and Wal-Mart de Mexico SAB De CV since 2009. He serves as Director of US-China Business Council, Inc. He serves on the Executive Board of Directors of Center of Retailing Excellence at the University of Arkansas and on the Corporate Board of Advisors for National Council at La Raza. He served as Director of Massmart Holdings Ltd. from June 20, 2011 to August 20, 2012. He has been recognized as a Young Global Leader by the World Economic Forum. Mr. McMillon graduated from the University of Arkansas in Fayetteville, with a Bachelor of Science in Business Administration (BSBA) in Accounting. He received an M.B.A. in Finance from the University of Tulsa. (alternate name Sam's Club) from August 4, 2005 to April 3, 2009. He was responsible for the overall corporate strategy and direction of Sam's Club. Mr. McMillon served as an Executive Vice President of Merchandising and Replenishment of Sam's Club of Wal Mart Stores Inc. until August 2005. He worked two consecutive summers as an Associate at the Wal-Mart Distribution Centers in Northwest Arkansas. He served as a Buyer Trainee for Wal-Mart working in Store #894 in Tulsa, OK. Mr. McMillon served as a Buyer for Food and Candy, Ladieswear and Crafts, a Divisional Merchandise Manager for Home Furnishings and Infants and Toddlers, Vice President and General Merchandise Manager at Sam���s Club International and Senior Vice President and General Merchandise Manager at Wal-Mart Stores Inc. oversaw purchases for Toys, Electronics, Video Games, Photo, Sporting Goods, Stationary and Office Supplies. Mr. McMillon serves as a Director of National Chapter of Students in Free Enterprise (SIFE). He has been a Director of Wal-Mart Stores Inc. since November 2013 and Wal-Mart de Mexico SAB De CV since 2009. He serves as Director of US-China Business Council, Inc. He serves on the Executive Board of Directors of Center of Retailing Excellence at the University of Arkansas and on the Corporate Board of Advisors for National Council at La Raza. He served as Director of Massmart Holdings Ltd. from June 20, 2011 to August 20, 2012. He has been recognized as a Young Global Leader by the World Economic Forum. Mr. McMillon graduated from the University of Arkansas in Fayetteville, with a Bachelor of Science in Business Administration (BSBA) in Accounting. He received an M.B.A. in Finance from the University of Tulsa.","702 SW 8th StreetBentonville, Arkansas 72716United States","Wal-Mart de Mexico SAB De CV|Sam's West, Inc.|Wal-Mart International|University of Tulsa|University of Arkansas - Fayetteville|Walmart Canada Corp.|Massmart Holdings Limited|US-China Business Council, Inc.",Male,NA,NA,NA,"Walmart - President and Chief Executive Officer, Sam s Club - nanette - Employment tenure | Walmart - Executive Vice President, Sam's Club Merchandising & Replenishment - nanette - Employment tenure | Walmart - Senior Vice President and General Merchandise Manager, Wal-Mart Stores, Inc. - nanette - Employment tenure | Walmart - Vice President and General Merchandise Manager, Sam s Club International - nanette - Employment tenure | Walmart - Divisional Merchandise Manager - nanette - Employment tenure | Walmart - Buyer - nanette - Employment tenure | Walmart - Buyer Trainee - nanette - Employment tenure | Walmart - Executive Vice President - ts_bot - Employment tenure | Walmart - Associate, Wal-Mart Distribution Centers - nanette - Employment tenure | ",,,,University of Arkansas,Accounting,University of Tulsa,MBA,,,,,,,,,,,,,,,,,,,,,,,,
WAG,Gregory D. Wasson,"Chief Executive Officer, President and Director,",Walgreen Co.,"School of Pharmacy, Purdue University",55,13654636,,2009,"Mr. Gregory D. Wasson, also known as Greg, has been Chief Executive Officer and President of Walgreen Co. since February 1, 2009 and May 1, 2007 respectively. Mr. Wasson served as Treasurer of National Association of Chain Drug Stores, Inc. since April 2010. He served as the President of Catalyst Rx Health Initiatives, Inc since March 2002. He joined Walgreens as a pharmacy intern in 1980 and managed several Houston Walgreens drugstores and served as its District Manager ... in 1986. He served as a Regional Vice President of Store Operations of Walgreen Co. in 1999. He served as an Executive Vice President of Walgreens Health Initiatives since 2001. Mr. Wasson served as the president of Walgreens Health Initiatives in 2002, and Walgreens senior vice president in 2004 and a Walgreens executive vice president in 2005. He served as President of Walgreens Health Services until May 1, 2007. He served as the President and Chief Operating Officer of Walgreen Co at Walgreens Health Services since May 1, 2007. He served as Chairman for the National Association of Chain Drug Stores, Inc. since April 23, 2012 and Vice Chairman since May 2, 2011. He also serves on the boards of the Retail Industry Leaders Association, the Healthcare Leadership Council and the Consumer Goods Forum, among other organizations. Mr. Wasson has been a Director of Alliance Boots GmbH since August 2012. He has been Director of Walgreen Co. since February 01, 2009. He serves as a Director of World Business Chicago. He has been Director of Verizon Communications Inc since March 1, 2013 and Alliance Boots GmbH since August 2012. He also has been a Director of Alliance Boots Holdings Limited since August 2, 2012. Mr. Wasson served as a Director of National Association of Chain Drug Stores, Inc. from April 2010 to April, 2013. He is a member of The Economic Club of Chicago, The Business Council, The Wall Street Journal CEO Council and the civic committee of the Commercial Club of Chicago. Among activities on behalf of various non-profit organizations, he served as chairman for the Illinois chapter of the American Cancer Society's Chief Executive Officer s Against Cancer. and after earning his bachelor's degree from Purdue University in 1981. He is a registered pharmacist in Nevada and Texas. Mr. Wasson earned a B.S. in pharmacy from Purdue University, West Lafayette, in 1981. in 1986. He served as a Regional Vice President of Store Operations of Walgreen Co. in 1999. He served as an Executive Vice President of Walgreens Health Initiatives since 2001. Mr. Wasson served as the president of Walgreens Health Initiatives in 2002, and Walgreens senior vice president in 2004 and a Walgreens executive vice president in 2005. He served as President of Walgreens Health Services until May 1, 2007. He served as the President and Chief Operating Officer of Walgreen Co at Walgreens Health Services since May 1, 2007. He served as Chairman for the National Association of Chain Drug Stores, Inc. since April 23, 2012 and Vice Chairman since May 2, 2011. He also serves on the boards of the Retail Industry Leaders Association, the Healthcare Leadership Council and the Consumer Goods Forum, among other organizations. Mr. Wasson has been a Director of Alliance Boots GmbH since August 2012. He has been Director of Walgreen Co. since February 01, 2009. He serves as a Director of World Business Chicago. He has been Director of Verizon Communications Inc since March 1, 2013 and Alliance Boots GmbH since August 2012. He also has been a Director of Alliance Boots Holdings Limited since August 2, 2012. Mr. Wasson served as a Director of National Association of Chain Drug Stores, Inc. from April 2010 to April, 2013. He is a member of The Economic Club of Chicago, The Business Council, The Wall Street Journal CEO Council and the civic committee of the Commercial Club of Chicago. Among activities on behalf of various non-profit organizations, he served as chairman for the Illinois chapter of the American Cancer Society's Chief Executive Officer s Against Cancer. and after earning his bachelor's degree from Purdue University in 1981. He is a registered pharmacist in Nevada and Texas. Mr. Wasson earned a B.S. in pharmacy from Purdue University, West Lafayette, in 1981.","108 Wilmot RoadDeerfield, Illinois 60015United States","Verizon Communications Inc.|Catalyst Rx Health Initiatives, Inc.|Alliance Boots Holdings Limited|Purdue University|National Association of Chain Drug Stores, Inc.|Walgreens Health Services|World Business Chicago|School of Pharmacy, Purdue University|Retail Industry Leaders Association|Alliance Boots GmbH",Male,NA,NA,NA,,,,,"School of Pharmacy, Purdue University",BS,NA,NA,,,,,,,,,,,,,,,,,,,,,,,,
DIS,Robert A. Iger,"Chairman, Chief Executive Officer, President and Member of Executive Committee,",The Walt Disney Company,Ithaca College,62,34321055,,2005,"Mr. Robert A. Iger, also known as Bob, has been the Chief Executive Officer and President at The Walt Disney Company since October 2, 2005 and has been its Chairman since March 13, 2012. He served as the Chief Operating Officer of The Walt Disney Company from January 2000 to September 2005 and its President since January 2000. He served as the President of Walt Disney International and Chairman of the ABC Group from February 1999 to January 2000. He held a number of ... increasingly responsible positions at ABC, Inc. and its predecessor Capital Cities/ ABC, Inc., culminating in service as the President and Chief Operating Officer of ABC, Inc. from 1994 to 1999. He officially joined the Disney senior management team in 1996 as Chairman of the Disney-owned ABC Group. He began his career at ABC in 1974 as a Studio Supervisor in New York, then moved to ABC Sports, where he advanced over a 12-year period through a series of increasingly responsible management posts. Mr. Iger has held a series of increasingly responsible senior management positions at ABC, where he guided the complex merger of ABC at The Walt Disney Company. He served as Vice President of Programming and was responsible for all scheduling and program acquisitions at ABC Sports since 1987. He served as the President of ABC Entertainment in Los Angeles. He served as the President of the ABC Television Network Group in New York since 1993. During his years at ABC, he oversaw its broadcast television network and station, cable television, radio and publishing businesses, which includes the market leading brands of ABC, ESPN, Lifetime, A&E and The History Channel. He served as the Chief Executive Officer of MarketWatch, Inc. since 2006. He was employed at ABC Holding Company, Inc. He served as the Chairman of the Disney-owned ABC Group since 1996. Mr. Iger has been a Director of The Walt Disney Co. since 2000. He has been an Independent Director of Apple Inc. since November 2011. He has been a Board Member of the U.S.-China Business Council in June 2011. He is also a Member of the Partnership for a New American Economy, a coalition of mayors and business leaders from across the United States that support comprehensive immigration reform. He serves as a Director of National September 11 Memorial & Museum at the World Trade Center Foundation, Inc., Lincoln Center for the Performing Arts Inc., and New York City Outward Bound. In June 2010, he was appointed as U.S. President's Export Council, which advises the U.S. president on how to promote U.S. exports, jobs and growth. He serves as a Trustee of the Museum of Television and Radio of Ithaca College. Mr. Iger serves as a Trustee of American Film Institute. He serves as a Member of Foundation Committee at The Motion Picture and Television Fund. He serves on the Executive Advisory Board of the Elizabeth Glaser Pediatric AIDS Foundation. He served as a Director of ABC, Inc. (formerly Capital Cities/ABC Inc.) since 1994 and Infoseek Corp., since November 1998. He was employed at ESPN Holding Company, Inc. He has been named one of Fortune magazine's ﾊﾗﾓ25 Most Powerful People in Businessﾊﾗﾓ (2006, 2007); one of the ﾊﾗﾓTop Gun CEOsﾊﾗﾓ by Forbes magazine (2009) and one of the ﾊﾗﾓBest CEOsﾊﾗﾓ by Institutional Investor magazine (2008, 2009, 2010, 2011). He graduated magna cum laude. Mr. Iger holds a BS in Communications from Ithaca College. increasingly responsible positions at ABC, Inc. and its predecessor Capital Cities/ ABC, Inc., culminating in service as the President and Chief Operating Officer of ABC, Inc. from 1994 to 1999. He officially joined the Disney senior management team in 1996 as Chairman of the Disney-owned ABC Group. He began his career at ABC in 1974 as a Studio Supervisor in New York, then moved to ABC Sports, where he advanced over a 12-year period through a series of increasingly responsible management posts. Mr. Iger has held a series of increasingly responsible senior management positions at ABC, where he guided the complex merger of ABC at The Walt Disney Company. He served as Vice President of Programming and was responsible for all scheduling and program acquisitions at ABC Sports since 1987. He served as the President of ABC Entertainment in Los Angeles. He served as the President of the ABC Television Network Group in New York since 1993. During his years at ABC, he oversaw its broadcast television network and station, cable television, radio and publishing businesses, which includes the market leading brands of ABC, ESPN, Lifetime, A&E and The History Channel. He served as the Chief Executive Officer of MarketWatch, Inc. since 2006. He was employed at ABC Holding Company, Inc. He served as the Chairman of the Disney-owned ABC Group since 1996. Mr. Iger has been a Director of The Walt Disney Co. since 2000. He has been an Independent Director of Apple Inc. since November 2011. He has been a Board Member of the U.S.-China Business Council in June 2011. He is also a Member of the Partnership for a New American Economy, a coalition of mayors and business leaders from across the United States that support comprehensive immigration reform. He serves as a Director of National September 11 Memorial & Museum at the World Trade Center Foundation, Inc., Lincoln Center for the Performing Arts Inc., and New York City Outward Bound. In June 2010, he was appointed as U.S. President's Export Council, which advises the U.S. president on how to promote U.S. exports, jobs and growth. He serves as a Trustee of the Museum of Television and Radio of Ithaca College. Mr. Iger serves as a Trustee of American Film Institute. He serves as a Member of Foundation Committee at The Motion Picture and Television Fund. He serves on the Executive Advisory Board of the Elizabeth Glaser Pediatric AIDS Foundation. He served as a Director of ABC, Inc. (formerly Capital Cities/ABC Inc.) since 1994 and Infoseek Corp., since November 1998. He was employed at ESPN Holding Company, Inc. He has been named one of Fortune magazine's ﾊﾗﾓ25 Most Powerful People in Businessﾊﾗﾓ (2006, 2007); one of the ﾊﾗﾓTop Gun CEOsﾊﾗﾓ by Forbes magazine (2009) and one of the ﾊﾗﾓBest CEOsﾊﾗﾓ by Institutional Investor magazine (2008, 2009, 2010, 2011). He graduated magna cum laude. Mr. Iger holds a BS in Communications from Ithaca College.","500 South Buena Vista StreetBurbank, California 91521United States","Apple Inc.|Infoseek Corporation|ABC, Inc.|MarketWatch, Inc.|The Walt Disney Studios|Ithaca College|American Film Institute|ESPN Holding Company, Inc.|The Motion Picture and Television Fund|Lincoln Center for the Performing Arts, Inc.|Disney Consumer Products, Inc.|National September 11 Memorial & Museum at the World Trade Center Foundation, Inc.|ABC Holding Company, Inc.",,NA,NA,NA,,,,,Ithaca College,BS,NA,NA,,,,,,,,,,,,,,,,,,,,,,,,
WM,David P. Steiner,"Chief Executive Officer, President and Director,","Waste Management, Inc.",University of California-Los Angeles,53,7662138,,2004,"Mr. David P. Steiner has been the Chief Executive Officer of Waste Management, Inc. since March 08, 2004 and as its President since June 2010. He joined Waste Management Inc. in November 2000. He served as the Chief Financial Officer and Executive Vice President of Waste Management, Inc. from April 2003 to March 2004 and served as its Senior Vice President from July 2001 to April 2003, Corporate Secretary from July 2001 to December 8, 2003, General Counsel from July ... 2001 to November 3, 2003 and Vice President and Deputy General Counsel from November 2000 to July 2001. He served as a Partner of Phelps Dunbar LLP, a regional law firm from 1990 to November 2000 and as an Attorney of Gibson, Dunn & Crutcher. He has been a Director of Waste Management Inc., since March 2004 and TE Connectivity Ltd., since June 30, 2007. He has been a Director for FedEx Corporation since October 2009. He serves as a Director of Greater Houston Partnership. He serves as a Director of Federal Express Corporation. Mr. Steiner holds a Bachelor's degree in Accounting from Louisiana State University and a Law degree from University of California, Los Angeles. 2001 to November 3, 2003 and Vice President and Deputy General Counsel from November 2000 to July 2001. He served as a Partner of Phelps Dunbar LLP, a regional law firm from 1990 to November 2000 and as an Attorney of Gibson, Dunn & Crutcher. He has been a Director of Waste Management Inc., since March 2004 and TE Connectivity Ltd., since June 30, 2007. He has been a Director for FedEx Corporation since October 2009. He serves as a Director of Greater Houston Partnership. He serves as a Director of Federal Express Corporation. Mr. Steiner holds a Bachelor's degree in Accounting from Louisiana State University and a Law degree from University of California, Los Angeles.","1001 Fannin StreetHouston, Texas 77002United States","Federal Express Corporation (US)|FedEx Corporation|Wheelabrator Technologies, Inc.|University of California|University of California-Los Angeles|Louisiana State University|Waste Management Of Arizona Inc.|TE Connectivity Ltd.|Greater Houston Partnership|Tyco Electronics Group S.A.",Male,NA,NA,NA,"Waste Management, Inc - Chief Executive Officer - ts_bot - Employment tenure | ",,,,Louisiana State University,NA,University of California-Los Angeles,NA,,,,,,,,,,,,,,,,,,,,,,,,
WAT,Douglas A. Berthiaume,"Chairman, Chief Executive Officer and President,",Waters Corporation,,64,1062972,,1994,"Mr. Douglas A. Berthiaume, also known as Doug, has been the Chief Executive Officer of Waters Technologies Corporation since August 1994 and President since March 2003. Mr. Berthiaume has been the Chairman of the Board of Waters Corporation since February 1996, and has been its Chief Executive Officer and President since August 1994 and March 2003 respectively. He served as the President of Waters Technologies Corporation from August 1994 to January 2002. and Waters ... Corporation since August 1994 until January 2002. From November 1990 to August 1994, he served as the President of the Waters Division of Millipore Corporation, the predecessor business of Waters Technologies Corporation, which was purchased in 1994. He has been the Chairman of the Board of Waters Technologies Corporation since February 1996. Mr. Berthiaume served as the Chairman of the Board of the Children's Hospital Trust, and the Analytical & Life Science Systems Association. He has been a Director of Waters Corp. and Waters Technologies Corporation since August 1994. Mr. Berthiaume has been a Director of Sanofi Biosurgery Corporation. since 1988. He has been Independent Director of Genzyme Corporation since 1988. Mr. Berthiaume serves as a Trustee of Boston Children's Hospital. He served as an Independent Director of Genzyme Oncology since 1988. He served as a Director of Genzyme Surgical Products. He served as a Director of Genzyme General and Genzyme Tissue Repair since 1988. Corporation since August 1994 until January 2002. From November 1990 to August 1994, he served as the President of the Waters Division of Millipore Corporation, the predecessor business of Waters Technologies Corporation, which was purchased in 1994. He has been the Chairman of the Board of Waters Technologies Corporation since February 1996. Mr. Berthiaume served as the Chairman of the Board of the Children's Hospital Trust, and the Analytical & Life Science Systems Association. He has been a Director of Waters Corp. and Waters Technologies Corporation since August 1994. Mr. Berthiaume has been a Director of Sanofi Biosurgery Corporation. since 1988. He has been Independent Director of Genzyme Corporation since 1988. Mr. Berthiaume serves as a Trustee of Boston Children's Hospital. He served as an Independent Director of Genzyme Oncology since 1988. He served as a Director of Genzyme Surgical Products. He served as a Director of Genzyme General and Genzyme Tissue Repair since 1988.","34 Maple StreetMilford, Massachusetts 01757United States","Genzyme Tissue Repair|Genzyme Corporation|Genzyme Oncology, Inc.|Genzyme Surgical Products|Genzyme General|Sanofi Biosurgery|Waters Technologies Corporation|Boston Children's Hospital|Children's Hospital Trust",Male,,,,Waters Corporation - Chairman - ts_bot - Employment tenure | Waters Corporation - Chief Executive Officer - ts_bot - Employment tenure | ,,,,,,,,,,,,,,,,,,,,,,,,,,,,,,,
