TJX,Carol M. Meyrowitz,"Chief Executive Officer and Director,","The TJX Companies, Inc.",,59,21768800,,2007,"Ms. Carol M. Meyrowitz has been the Chief Executive Officer of The TJX Companies, Inc. since January 28, 2007. Ms. Meyrowitz serves as the Chief Executive Officer of T.J. Maxx, Inc. She served as an Advisor of Berkshire Partners, LLC. She served as an Advisor of TJX Companies Inc. from January 21, 2005 to October 2005. She served as the President of TJX Companies from October 17, 2005 to January 30, 2011. She served as the President at T.J. Maxx, Inc., a subsidiary of ... TJX Companies Inc. She has extensive management experience. She has been with TJX since 1983. Ms. Meyrowitz served as Senior Executive Vice President of The TJX Companies Inc. from March 29, 2004 to January 21, 2005 and President at The Marmaxx Group from 2001 to January 21, 2005. She served as an Executive Vice President of TJX Companies, Inc. from 2001 to March 29, 2004. She served as an Executive Vice President of Merchandising of Marmaxx Group from 2000 to 2001 and Senior Vice President of Merchandising from 1999 to 2000. She served as an Executive Vice President of Merchandising for Chadwick's of Boston Ltd., from 1996 to 1999; Senior Vice President of Merchandising from 1991 to 1996 and Vice President of Merchandising from 1989 to 1991. She served as an Executive Vice President of Merchandising - Chadwick business of Redcats USA, Inc. from December 1996 to 1999. Ms. Meyrowitz served as the General Merchandise Manager of Chadwick's from March 1990 to March 1991 and Vice President and Senior Merchandise Manager from January 1989 to March 1990. She served as Vice President of Division Merchandise Manager, Hit or Miss from 1987 to 1989 and served as President of Homegoods, Inc. Ms. Meyrowitz has been an Independent Director of Party City Holdings Inc. since August 2006, Staples, Inc. since December 2007, The TJX Companies, Inc. since September 2006 and Amscan Holdings Inc. since August 2006. She is a Member of the board of overseers for the Joslin Diabetes Center. Ms. Meyrowitz served as an Independent Director of Yankee Holding Corp. from September 2, 2004 to 2007. TJX Companies Inc. She has extensive management experience. She has been with TJX since 1983. Ms. Meyrowitz served as Senior Executive Vice President of The TJX Companies Inc. from March 29, 2004 to January 21, 2005 and President at The Marmaxx Group from 2001 to January 21, 2005. She served as an Executive Vice President of TJX Companies, Inc. from 2001 to March 29, 2004. She served as an Executive Vice President of Merchandising of Marmaxx Group from 2000 to 2001 and Senior Vice President of Merchandising from 1999 to 2000. She served as an Executive Vice President of Merchandising for Chadwick's of Boston Ltd., from 1996 to 1999; Senior Vice President of Merchandising from 1991 to 1996 and Vice President of Merchandising from 1989 to 1991. She served as an Executive Vice President of Merchandising - Chadwick business of Redcats USA, Inc. from December 1996 to 1999. Ms. Meyrowitz served as the General Merchandise Manager of Chadwick's from March 1990 to March 1991 and Vice President and Senior Merchandise Manager from January 1989 to March 1990. She served as Vice President of Division Merchandise Manager, Hit or Miss from 1987 to 1989 and served as President of Homegoods, Inc. Ms. Meyrowitz has been an Independent Director of Party City Holdings Inc. since August 2006, Staples, Inc. since December 2007, The TJX Companies, Inc. since September 2006 and Amscan Holdings Inc. since August 2006. She is a Member of the board of overseers for the Joslin Diabetes Center. Ms. Meyrowitz served as an Independent Director of Yankee Holding Corp. from September 2, 2004 to 2007.","770 Cochituate RoadFramingham, Massachusetts 01701United States","Berkshire Partners LLC|Redcats USA, Inc.|Staples, Inc.|Yankee Holding Corp.|Amscan Holdings Inc.|Homegoods, Inc.|T.J. Maxx, Inc.|Party City Holdings Inc.",Female,NA,NA,NA,,,,,NA,NA,,NA,,,,,,,,,,,,,,,,,,,,,,,,
TMK,Gary L. Coleman,"Co-Chief Executive Officer, Director and Co-Chairman of Enterprise Risk Management Committee,",Torchmark Corporation,The University of Texas System,60,6235617,,2012,"Mr. Gary L. Coleman has been the Co-Chief Executive Officer of Torchmark Corp. since June 1, 2012 and served as Executive Vice President and Chief Financial Officer since September 1999 until June 2012. Mr. Coleman served as the Principal Accounting Officer of Torchmark Corp. until February 20, 2007. Mr. Coleman served as a Vice President and Chief Accounting Officer of Torchmark Corp., July 1994 to September 1999.  He has been a Director of Torchmark Corp. since August ... 2012. He holds a B.B.A from the University of Texas. 2012. He holds a B.B.A from the University of Texas.","3700 South Stonebridge DriveMcKinney, Texas 75070United States",The University of Texas System,Male,NA,NA,NA,Torchmark - Chief Financial Officer - ts_bot - Employment tenure | Torchmark - Executive Vice President - ts_bot - Employment tenure | ,,,,The University of Texas System,BBA,NA,NA,,,,,,,,,,,,,,,,,,,,,,,,
TSS,Philip W. Tomlinson,"Chairman, Chief Executive Officer and Member of Executive Committee,","Total System Services, Inc.",Graduate School of Banking at Louisiana State University,67,4958885,,2003,"Mr. Philip W. Tomlinson, also known as Phil, serves as the Chief Executive Officer at Total System Services, Inc. (TSYS) since December 2003. Since 1983, Mr. Tomlinson has played a key role in almost every major relationship that has shaped TSYS development. He served as the President of Total System Services, Inc., from February 1992 to December 2003 and its Executive Vice President from 1982 to 1992. He joined Columbus Bank and Trust Company (Columbus, Ga.) in 1974, ... after a successful management career with General Electric Corporation. He has been the Chairman of Total System Services, Inc. (TSYS) since January 2006. Mr. Tomlinson has been a Director of Total System Services, Inc., since 1982 and Synovus Financial Corp., since 2008. He serves as a Director for TSYS de Mexico, TSYS Acquiring Solutions and GP Network Corporation. He is a Member of the Georgia Tech Advisory Board, American Cancer Society Board, the Muscogee Educational Excellence Foundation Board (MEEF), the Columbus State University Board of Trustees, the Columbus State Cunningham Center for Leadership Development Advisory Board, the United Way Board, and the Financial Services Roundtable. He is the 2006 Chairman of the Greater Columbus Chamber of Commerce. Mr. Tomlinson is a Graduate of Louisiana State University's School of Banking of the South. after a successful management career with General Electric Corporation. He has been the Chairman of Total System Services, Inc. (TSYS) since January 2006. Mr. Tomlinson has been a Director of Total System Services, Inc., since 1982 and Synovus Financial Corp., since 2008. He serves as a Director for TSYS de Mexico, TSYS Acquiring Solutions and GP Network Corporation. He is a Member of the Georgia Tech Advisory Board, American Cancer Society Board, the Muscogee Educational Excellence Foundation Board (MEEF), the Columbus State University Board of Trustees, the Columbus State Cunningham Center for Leadership Development Advisory Board, the United Way Board, and the Financial Services Roundtable. He is the 2006 Chairman of the Greater Columbus Chamber of Commerce. Mr. Tomlinson is a Graduate of Louisiana State University's School of Banking of the South.","One TSYS WayColumbus, Georgia 31901United States",Synovus Financial Corporation|GP Network Corporation|Graduate School of Banking at Louisiana State University,Male,NA,NA,NA,TSYS - Chairman - ts_bot - Employment tenure | TSYS - Chief Executive Officer - ts_bot - Employment tenure | ,,,,Graduate School of Banking at Louisiana State University,NA,NA,NA,,,,,,,,,,,,,,,,,,,,,,,,
RIG,Steven L. Newman,"Chief Executive Officer, President, Director and Member of Executive Risk Management Committee,",Transocean Ltd.,Harvard Business School,48,14051895,,2010,"Mr. Steven L. Newman has been the Chief Executive Officer at Transocean Ltd. since March 1, 2010 and its President since May 2008. Mr. Newman served as the Chief Operating Officer of Transocean Ltd. from May 2008 to November 20009 and also previously served as its Chief Operating Officer since October 18, 2006. Mr. Newman served as an Executive Vice President of Performance at Transocean Inc. from 2007 to May 2008 and also served as its Chief Operating Officer since ... October 18, 2006, Senior Vice President of Human Resources, Information Process Solutions and Treasury from March 2005 to October 18, 2006. and also served as Vice President of Performance and Technology. At Transocean, he served as Regional Manager for the Asia and Australia Region, based in Jakarta, Indonesia, and held a variety of international field and operations management positions, including Project Engineer, Rig Manager, Division Manager, Region Marketing Manager, and Region Operations Manager. He has been employed by the Transocean Inc., since 1994 in the corporate planning Department. He has been a Director at Transocean Ltd., since May 14, 2010. Mr. Newman holds a Bachelor of Science in Petroleum Engineering from the Colorado School of Mines in 1989 and an MBA from the Harvard University Graduate School of Business in 1992. October 18, 2006, Senior Vice President of Human Resources, Information Process Solutions and Treasury from March 2005 to October 18, 2006. and also served as Vice President of Performance and Technology. At Transocean, he served as Regional Manager for the Asia and Australia Region, based in Jakarta, Indonesia, and held a variety of international field and operations management positions, including Project Engineer, Rig Manager, Division Manager, Region Marketing Manager, and Region Operations Manager. He has been employed by the Transocean Inc., since 1994 in the corporate planning Department. He has been a Director at Transocean Ltd., since May 14, 2010. Mr. Newman holds a Bachelor of Science in Petroleum Engineering from the Colorado School of Mines in 1989 and an MBA from the Harvard University Graduate School of Business in 1992.","10 Chemin de BlandonnetVernier, Geneva 1214Switzerland",Harvard Business School|Colorado School of Mines,Male,NA,United states of America,United States of America | ,Transocean - Executive Vice President - ts_bot - Employment tenure | Transocean - Chief Operating Officer - ts_bot - Employment tenure | ,,,,Colorado School of Mines,Petroleum Engineering,Harvard University,MBA,,,,,,,,,,,,,,,,,,,,,,,,
TRV,Jay S. Fishman,"Chairman, Chief Executive Officer, Chairman of Executive Committee and Member of Operating Committee,","The Travelers Companies, Inc.",The University of Pennsylvania,60,15729551,,2001,"Mr. Jay S. Fishman has been Chief Executive Officer of The Travelers Companies, Inc. since  since October 2001. Mr. Fishman served as the President of The Travelers Companies, Inc., from October 2001 to June 2008. Mr. Fishman has served as the Chief Executive Officer of Travelers since the April 2004 merger of The St. Paul Companies, Inc. with Travelers Property Casualty Corp. that formed Travelers. He served as the President, Chairman, and Chief Administrative officer ... of Travelers Property Casualty Corp. Mr. Fishman served as the Chief Administrative Officer and Chief Operating Officer, Commercial Lines of Travelers Insurance Group Holdings Inc. from 1996 to 1998. He served as the Chief Administrative Officer at Travelers Insurance Group Inc. (TIGI) since 1996. He served as the Chief Executive Officer and President of Travelers Insurance Group Holdings Inc. since 1998. He first became associated with Travelers when he was named the insurer's Chief Financial Officer in 1993, upon its acquisition by Primerica Corp., where he served as an Executive. He served as the Treasurer of Travelers Group from 1991 to 1993, Chief Financial Officer of Travelers Group's Consumer and Financial Services Group from 1989 to 1991. He joined Travelers Group in 1989. He led The St. Paul Companies Inc. as the Chairman, President and Chief Executive Officer since October 2001 until April 2004. In April 2004, St. Paul Companies merged with Travelers Property Casualty Corp., which had since been divested by Citigroup. Prior to joining The St. Paul Companies, Mr. Fishman held several executiv eposts at Citigroup Inc. from 1998 to 2001. He served as the Chief Executive Officer, President and Chief Operating Officer of Finance & Risk at Citigroup Inc. since April 1989 and also served as its President and Chief Executive Officer. He served as the Head of Citigroup's global insurance businesses and the consumer business in Japan and Western Europe. Mr. Fishman held several key executive posts at Primerica, Travelers and Citigroup from 1989 to October 2001. Prior to 1989, he served at Shearson Lehman Brothers, where he served as a Senior Vice President of Merchant Banking. Previously, he served as a Principal in a private investment and leveraged buyout firm, and a Director for Mergers and Acquisitions of American Can Company. He has been the Chairman of  The Travelers Companies, Inc. since September 12, 2005.He has been the Chairman of New York City Ballet, Inc., since June 19, 2012 and also serves as its Director. He has been a Director of Carlyle Group Management LLC, a General Partner of The Carlyle Group LP since May 2, 2012. He has been an Executive Director of The Travelers Companies, Inc., since October 2001. He has been a Director at Exxon Mobil Corp., since May 26, 2010 and has been Presiding Director since 2013. He serves as a Director of Committee Encouraging Corporate Philanthropy and The Carlyle Group LP. He serves on the Board of Directors of the National Academy Foundation and is an active member of The Business Council. He serves as a Director of the New York Philharmonic; Lincoln Center for the Performing Arts, Inc. and Trustee of New York-Presbyterian Hospital. He serves as a Director of The Partnership for New York City, Inc. and New York City Ballet, Inc. At the University of Pennsylvania, he is a Member of the Board of Trustees and the Industry Advisory Board of the Financial Institutions Center for The Wharton School. He is also a Member of the Board of Overseers of the University of Pennsylvania School of Veterinary Medicine. Mr. Fishman served as the Chairman of Travelers Insurance Group Holdings Inc. from March 2000 to January 2001 and Vice Chairman from 1996 to 1998. He served as a Vice Chairman of TIGI since 1995. He serves as a Vice Chairman of the Kennedy Center Corporate Fund Board. Mr. Fishman served as a Director of Englewood Hospital & Medical Center, Board Member of Connecticut Public Broadcasting, Inc.; Platinum Underwriters Holdings Ltd. from June 2002 to April 29, 2005; and Nuveen Investments Inc. from October 2001 to August 4, 2005. He served as a Director of The St. Paul Companies, Inc. since October 10, 2011 and Travelers Insurance Group Holdings, Inc. since 1998. Mr. Fishman served as a Director of The Philharmonic-Symphony Society of New York, Inc. He served as the Chairman of the American Insurance Association. He also served as a Member of the Carlson School of Management Board of Overseers at the University of Minnesota. Mr. Fishman received a Master's degree in Accounting from the Wharton School in 1974 and is an Alumnus of the University of Pennsylvania, graduated with a Bachelor's degree in Economics, magna cum laude, in 1974. of Travelers Property Casualty Corp. Mr. Fishman served as the Chief Administrative Officer and Chief Operating Officer, Commercial Lines of Travelers Insurance Group Holdings Inc. from 1996 to 1998. He served as the Chief Administrative Officer at Travelers Insurance Group Inc. (TIGI) since 1996. He served as the Chief Executive Officer and President of Travelers Insurance Group Holdings Inc. since 1998. He first became associated with Travelers when he was named the insurer's Chief Financial Officer in 1993, upon its acquisition by Primerica Corp., where he served as an Executive. He served as the Treasurer of Travelers Group from 1991 to 1993, Chief Financial Officer of Travelers Group's Consumer and Financial Services Group from 1989 to 1991. He joined Travelers Group in 1989. He led The St. Paul Companies Inc. as the Chairman, President and Chief Executive Officer since October 2001 until April 2004. In April 2004, St. Paul Companies merged with Travelers Property Casualty Corp., which had since been divested by Citigroup. Prior to joining The St. Paul Companies, Mr. Fishman held several executiv eposts at Citigroup Inc. from 1998 to 2001. He served as the Chief Executive Officer, President and Chief Operating Officer of Finance & Risk at Citigroup Inc. since April 1989 and also served as its President and Chief Executive Officer. He served as the Head of Citigroup's global insurance businesses and the consumer business in Japan and Western Europe. Mr. Fishman held several key executive posts at Primerica, Travelers and Citigroup from 1989 to October 2001. Prior to 1989, he served at Shearson Lehman Brothers, where he served as a Senior Vice President of Merchant Banking. Previously, he served as a Principal in a private investment and leveraged buyout firm, and a Director for Mergers and Acquisitions of American Can Company. He has been the Chairman of  The Travelers Companies, Inc. since September 12, 2005.He has been the Chairman of New York City Ballet, Inc., since June 19, 2012 and also serves as its Director. He has been a Director of Carlyle Group Management LLC, a General Partner of The Carlyle Group LP since May 2, 2012. He has been an Executive Director of The Travelers Companies, Inc., since October 2001. He has been a Director at Exxon Mobil Corp., since May 26, 2010 and has been Presiding Director since 2013. He serves as a Director of Committee Encouraging Corporate Philanthropy and The Carlyle Group LP. He serves on the Board of Directors of the National Academy Foundation and is an active member of The Business Council. He serves as a Director of the New York Philharmonic; Lincoln Center for the Performing Arts, Inc. and Trustee of New York-Presbyterian Hospital. He serves as a Director of The Partnership for New York City, Inc. and New York City Ballet, Inc. At the University of Pennsylvania, he is a Member of the Board of Trustees and the Industry Advisory Board of the Financial Institutions Center for The Wharton School. He is also a Member of the Board of Overseers of the University of Pennsylvania School of Veterinary Medicine. Mr. Fishman served as the Chairman of Travelers Insurance Group Holdings Inc. from March 2000 to January 2001 and Vice Chairman from 1996 to 1998. He served as a Vice Chairman of TIGI since 1995. He serves as a Vice Chairman of the Kennedy Center Corporate Fund Board. Mr. Fishman served as a Director of Englewood Hospital & Medical Center, Board Member of Connecticut Public Broadcasting, Inc.; Platinum Underwriters Holdings Ltd. from June 2002 to April 29, 2005; and Nuveen Investments Inc. from October 2001 to August 4, 2005. He served as a Director of The St. Paul Companies, Inc. since October 10, 2011 and Travelers Insurance Group Holdings, Inc. since 1998. Mr. Fishman served as a Director of The Philharmonic-Symphony Society of New York, Inc. He served as the Chairman of the American Insurance Association. He also served as a Member of the Carlson School of Management Board of Overseers at the University of Minnesota. Mr. Fishman received a Master's degree in Accounting from the Wharton School in 1974 and is an Alumnus of the University of Pennsylvania, graduated with a Bachelor's degree in Economics, magna cum laude, in 1974.","485 Lexington AvenueNew York, New York 10017United States","The Carlyle Group LP|Nuveen Investments, Inc.|The St. Paul Companies, Inc.|Citigroup Inc.|Exxon Mobil Corporation|Connecticut Public Broadcasting|Englewood Hospital & Medical Center|The Philharmonic-Symphony Society of New York, Inc.|Platinum Underwriters Holdings Ltd.|The University of Pennsylvania|Travelers Insurance Group Holdings Inc.|University of Pennsylvania - The Wharton School|Lincoln Center for the Performing Arts, Inc.|New York City Ballet, Inc.|The Partnership for New York City, Inc.|Travelers Property Casualty Corp.|Committee Encouraging Corporate Philanthropy",Male,NA,United states of America,United States of America | ,"The Travelers Companies - 2007 - President and CEO - alden - Employment tenure | The Travelers Companies - 2004 - President and CEO - 2007 - ts_bot - Employment tenure | St. Paul Companies - 2001 - President and CEO - 2004 - alden - Employment tenure | Citigroup - 2000 - Chief Operating Officer, Finance and Risk - 2001 - alden - Employment tenure | Travelers Group - 1998 - President and CEO - 2001 - alden - Employment tenure | Travelers Group - 1994 - Senior Vice President and Chief Financial Officer - 1998 - alden - Employment tenure | Primerica - 1991 - Senior Vice President and Treasurer - 1994 - alden - Employment tenure | Commercial Credit Company - 1989 - Executive Vice President and Chief Financial Officer - 1991 - alden - Employment tenure | Shearson Lehman Brothers Inc. - 1986 - Senior Vice President, Merchant Banking - 1989 - alden - Employment tenure | American Can Company - 1979 - 1983 - alden - Employment tenure | ",Edward Fishman | Shirley Cantor | ,,,The University of Pennsylvania,NA,University of Pennsylvania - The Wharton School,MBA,,,,,,,,,,,,,,,,,,,,,,,,
TRIP,Stephen   Kaufer,"Co-Founder, Chief Executive Officer, President, Director and Member of Executive Committee,",TripAdvisor Inc.,Harvard University,50,6393475,,2000,"Mr. Stephen Kaufer, also known as Steve Co-founded TripAdvisor Inc. in February 2000 and has been its Chief Executive Officer and President since February 2000. Mr. Kaufer serves as the Chief Executive Officer of TripAdvisor LLC. He has built the TripAdvisor Media Group, consisting of 19 leading travel brands, and has expanded the TripAdvisor brand into 30 countries, including France, Germany, Greece, Italy, India, Japan, Russia, Spain, the U.K., Indonesia, Argentina, ... Taiwan, Malaysia, and Egypt. He serves as an Advisor of CarGurus LLC. He is also an advisor to WeddingBook, a wedding planning site, and Abroad101. He served as the President of CDS, Inc. He co-founded CenterLine Software and served as its Vice President of engineering, where he led the development of several award winning programming environments that fueled the CenterLine Software's growth to 20+ million in revenues. He serves as a Director of DigitalAdvisor LLC. He serves as a Director of Glassdoor, Inc. He serves as a Director of TripAdvisor Inc. and LiveData Inc. He serves as a Director of the Caring for Carcinoid Foundation and CarGurus LLC. He is on the board of directors at a deals site (www.beatthat.com ). He holds several software patents, and has spoken at dozens of high-tech conferences worldwide. He is the winner of the 2005 Ernst & Young Entrepreneur of the Year Award. Mr. Kaufer holds a BS in Computer Science from Harvard University. Taiwan, Malaysia, and Egypt. He serves as an Advisor of CarGurus LLC. He is also an advisor to WeddingBook, a wedding planning site, and Abroad101. He served as the President of CDS, Inc. He co-founded CenterLine Software and served as its Vice President of engineering, where he led the development of several award winning programming environments that fueled the CenterLine Software's growth to 20+ million in revenues. He serves as a Director of DigitalAdvisor LLC. He serves as a Director of Glassdoor, Inc. He serves as a Director of TripAdvisor Inc. and LiveData Inc. He serves as a Director of the Caring for Carcinoid Foundation and CarGurus LLC. He is on the board of directors at a deals site (www.beatthat.com ). He holds several software patents, and has spoken at dozens of high-tech conferences worldwide. He is the winner of the 2005 Ernst & Young Entrepreneur of the Year Award. Mr. Kaufer holds a BS in Computer Science from Harvard University.","141 Needham StreetNewton, Massachusetts 02464United States","Harvard University|LiveData, Inc.|Expedia Inc.|DigitalAdvisor LLC|Glassdoor, Inc.|CarGurus LLC",Male,NA,NA,NA,,,,,Harvard university,BS,NA,NA,,,,,,,,,,,,,,,,,,,,,,,,
