Nicholas K. Akins,"Chairman, Chief Executive Officer, President, Member of Executive Committee and Member of Policy Committee,","American Electric Power Co., Inc.",Louisiana Tech University,53,"$10,612,588 ",,2011,"Mr. Nicholas K. Akins, also known as Nick, has been the Chief Executive Officer at American Electric Power Co., Inc. since November 12, 2011 and as its President since January 1, 2011. Mr. Akins has been the Chief Executive Officer and President at Public Service Company of Oklahoma, Indiana Michigan Power Company and of Ohio Power Company since November 2011 and January 2011, respectively. Mr. Akins has been the President of AEP Transmission Holding Company LLC since ... January 1, 2011. He serves as the Chief Executive Officer and President of Southwestern Electric Power Company. He serves as the President of Ohio Valley Electric Corporation and Indiana-Kentucky Electric Corporation. He has been an Executive Vice President of AEP Texas North Company since 2006. He has been the President of Appalachian Power Company, a subsidiary of American Electric Power Company Inc. since January 1, 2011 and serves as its Chief Executive Officer. Mr. Akins serves as an Executive Vice President at American Electric Power Company Inc. He served as an Executive Vice President of Generation at AEP Pro Serv, Inc. from 2006 to 2010. He began his career in 1982 as an Electrical Engineer before moving up to positions of increasing responsibility. He served as Vice President at Appalachian Power Company since 2006. He served as Vice President of Public Service Company of Oklahoma and Ohio Power Company since 2006. Mr. Akins served as an Executive Vice President of American Electric Power Co., Inc. from 2006 to December 31, 2010 and also served as its Unit President. He served as an Executive Vice President of Generation at American Electric Power Service Corporation from September 1, 2006 to December 31, 2010. He served as the President and Chief Operating Officer of Southwestern Electric Power Company, a unit of American Electric Power Co. Inc. from 2004 to September 1, 2006 and served as its Vice President. He served as Vice President of Energy Marketing services of American Electric Power Service Corporation (AEPSC) from 2002 to 2004, where he was responsible for directing the activities of Market Development, including the transmission marketing and services functions. He served as Vice President of Energy Delivery and Business Development of AEPSC from 2001 to 2002 and was responsible for external affairs including community affairs, economic development, advocacy for regulatory and legislative positios within Energy Delivery. Additional responsibilities included the development and implementation of strategies for energy delivery related to AEP's entry into regional transmission organizations. He served as Vice President of Industry restructuring of AEP responsible for enterprise-wide program management for restructuring initiatives in preparation for customer choice in AEP's various jurisdictions. Mr. Akins served in various Director and Manager roles including CSWS Director of Restructuring Readiness, CSWS Director of Mergers and Acquisitions, CSWS Director of Solid Fuels, WTU Director of Fuels and other positions within system dispatch operations, planning, and fuels. He has been the Chairman of American Electric Power Co., Inc. since January 2014. He serves as chairman of Southwestern Electric Power Company. He has been the Chairman of Electric Power Research Institute, Inc, since April 17, 2012. He has been a Director of Fifth Third Bancorp since October 2013. He has been a Director of Southwestern Electric Power Company, Ohio Power Company, Appalachian Power Company, AEP Texas North Company, Public Service Company of Oklahoma and American Electric Power Service Corporation since 2006. Mr. Akins has been a Director of The Electric Power Research Institute, Inc, since April 17, 2012. He serves as a Director of Fifth Third Bank and Indiana-Kentucky Electric Corporation. and Ohio Valley Electric Corporation. He serves as a Director of Kentucky Power Company, AEP Texas Central Company, Columbus Southern Power Company, AEP Generating Company and of Indiana Michigan Power Company. He was a Director of Louisiana Tech Engineering Foundation. He was a Member of the National Society of Professional Engineers, Texas Society of Professional Engineers, and Tau Beta Pi and Eta Kappa Nu Engineering Honor Societies. He is a registered Professional Engineer in Texas. Mr. Akins received a Bachelor degree in Electrical Engineering from Louisiana Tech University in Ruston in 1982 and a Master degree in Electrical Engineering from Louisiana Techin 1986. He has completed Executive Management Programs at Louisiana State University and the University of Idaho. January 1, 2011. He serves as the Chief Executive Officer and President of Southwestern Electric Power Company. He serves as the President of Ohio Valley Electric Corporation and Indiana-Kentucky Electric Corporation. He has been an Executive Vice President of AEP Texas North Company since 2006. He has been the President of Appalachian Power Company, a subsidiary of American Electric Power Company Inc. since January 1, 2011 and serves as its Chief Executive Officer. Mr. Akins serves as an Executive Vice President at American Electric Power Company Inc. He served as an Executive Vice President of Generation at AEP Pro Serv, Inc. from 2006 to 2010. He began his career in 1982 as an Electrical Engineer before moving up to positions of increasing responsibility. He served as Vice President at Appalachian Power Company since 2006. He served as Vice President of Public Service Company of Oklahoma and Ohio Power Company since 2006. Mr. Akins served as an Executive Vice President of American Electric Power Co., Inc. from 2006 to December 31, 2010 and also served as its Unit President. He served as an Executive Vice President of Generation at American Electric Power Service Corporation from September 1, 2006 to December 31, 2010. He served as the President and Chief Operating Officer of Southwestern Electric Power Company, a unit of American Electric Power Co. Inc. from 2004 to September 1, 2006 and served as its Vice President. He served as Vice President of Energy Marketing services of American Electric Power Service Corporation (AEPSC) from 2002 to 2004, where he was responsible for directing the activities of Market Development, including the transmission marketing and services functions. He served as Vice President of Energy Delivery and Business Development of AEPSC from 2001 to 2002 and was responsible for external affairs including community affairs, economic development, advocacy for regulatory and legislative positios within Energy Delivery. Additional responsibilities included the development and implementation of strategies for energy delivery related to AEP's entry into regional transmission organizations. He served as Vice President of Industry restructuring of AEP responsible for enterprise-wide program management for restructuring initiatives in preparation for customer choice in AEP's various jurisdictions. Mr. Akins served in various Director and Manager roles including CSWS Director of Restructuring Readiness, CSWS Director of Mergers and Acquisitions, CSWS Director of Solid Fuels, WTU Director of Fuels and other positions within system dispatch operations, planning, and fuels. He has been the Chairman of American Electric Power Co., Inc. since January 2014. He serves as chairman of Southwestern Electric Power Company. He has been the Chairman of Electric Power Research Institute, Inc, since April 17, 2012. He has been a Director of Fifth Third Bancorp since October 2013. He has been a Director of Southwestern Electric Power Company, Ohio Power Company, Appalachian Power Company, AEP Texas North Company, Public Service Company of Oklahoma and American Electric Power Service Corporation since 2006. Mr. Akins has been a Director of The Electric Power Research Institute, Inc, since April 17, 2012. He serves as a Director of Fifth Third Bank and Indiana-Kentucky Electric Corporation. and Ohio Valley Electric Corporation. He serves as a Director of Kentucky Power Company, AEP Texas Central Company, Columbus Southern Power Company, AEP Generating Company and of Indiana Michigan Power Company. He was a Director of Louisiana Tech Engineering Foundation. He was a Member of the National Society of Professional Engineers, Texas Society of Professional Engineers, and Tau Beta Pi and Eta Kappa Nu Engineering Honor Societies. He is a registered Professional Engineer in Texas. Mr. Akins received a Bachelor degree in Electrical Engineering from Louisiana Tech University in Ruston in 1982 and a Master degree in Electrical Engineering from Louisiana Techin 1986. He has completed Executive Management Programs at Louisiana State University and the University of Idaho.","1 Riverside PlazaColumbus, Ohio 43215United States","Fifth Third Bancorp|Fifth Third Bank|Electric Power Research Institute, Inc.|Public Service Company of Oklahoma|Ohio Valley Electric Corporation|Ohio Power Company|Kentucky Power Company|Appalachian Power Company|AEP Texas Central Company|Columbus Southern Power Company|Indiana Michigan Power Company|Southwestern Electric Power Company|AEP Texas North Company|AEP Pro Serv, Inc.|American Electric Power Service Corporation|AEP Generating Company|Louisiana State University|University Of Idaho|Indiana-Kentucky Electric Corporation|Louisiana Tech University|AEP Transmission Holding Company, LLC",Male,,,,American Electric Power - Executive Vice President - ts_bot - Employment tenure | ,
James D. Taiclet Jr.,"Chairman, Chief Executive Officer and President ,",American Tower Corporation,U.S. Air Force Academy,52,"$11,161,164 ",,2003,"Mr. James D. Taiclet, Jr., also known as Jim, has been the President of American Tower Corporation since September 2001 and its Chief Executive Officer since October 10, 2003 and is also its Chairman since February 2004. Mr. Taiclet served as the President of Grimes Aerospace Company. He served as the Chief Operating Officer of American Tower Corporation from September 2001 to October 2003. Mr. Taiclet served as the President of Honeywell Aerospace Services, a part of ... Honeywell International, since March 1999. He served as Vice President of Engine Services of Pratt & Whitney, a unit of United Technologies Corporation from March 1996 to March 1999. Mr. Taiclet served as a Consultant at McKinsey & Company. He began his career as an Air Force Officer and Pilot and served in the Gulf War. Mr. Taiclet has been Executive Chairman of American Tower Corporation since February 2004 and its Executive Director since November 2003. He serves as a Director of MariTEL, Inc. He served as a Director of FiberTower Corporation since 2003. Mr. Taiclet serves as a member of the FCC Media Security and Reliability Council. He received a Masters in Public Affairs from Princeton University, where he was a Wilson Fellow, and is a graduate of the United States Air Force Academy. Honeywell International, since March 1999. He served as Vice President of Engine Services of Pratt & Whitney, a unit of United Technologies Corporation from March 1996 to March 1999. Mr. Taiclet served as a Consultant at McKinsey & Company. He began his career as an Air Force Officer and Pilot and served in the Gulf War. Mr. Taiclet has been Executive Chairman of American Tower Corporation since February 2004 and its Executive Director since November 2003. He serves as a Director of MariTEL, Inc. He served as a Director of FiberTower Corporation since 2003. Mr. Taiclet serves as a member of the FCC Media Security and Reliability Council. He received a Masters in Public Affairs from Princeton University, where he was a Wilson Fellow, and is a graduate of the United States Air Force Academy.","116 Huntington AvenueBoston, Massachusetts 02116United States","Grimes Aerospace Company|MariTEL, Inc.|FiberTower Corporation|Princeton University|U.S. Air Force Academy",Male,,,,American Tower Corporation - Chairman - ts_bot - Employment tenure | American Tower Corporation - President - ts_bot - Employment tenure | American Tower Corporation - Chief Executive Officer - ts_bot - Employment tenure | ,
James M. Cracchiolo,"Chairman, Chief Executive Officer and Chairman of Executive Committee,","Ameriprise Financial, Inc.",New York University,54,"$17,828,431 ",,2005,"Mr. James M. Cracchiolo, also known as Jim, has been the Chief Executive Officer at Ameriprise Financial Inc., (formerly, American Express Financial Corporation) since September 30, 2005. Prior to the Spin-Off, Mr. Cracchiolo served as Chairman and Chief Executive Officer of Ameriprise Financial Inc. since March 2001 and as its President and Chief Executive Officer since November 2000 and Group President of Global Financial Services of American Express since June 2000. ... He served as Chairman and Chief Executive Officer of American Express Financial Advisor since March 2001 and previously served as its President and Chief Executive Officer since June 2000. Mr. Cracchiolo served as President and Chief Executive Officer of American Express International Inc. He served as President and Chief Executive Officer of American Express Travel Related Services Company Inc. from May 1998 to July 2003. Prior thereto he had been President, Global Network Services of American Express Travel Related Services Company, Inc. since February 1997. He is responsible for all of American Express' financial services businesses globally, as well as International Payments. Mr.Cracchiolo is currently assigned with the responsibility of focusing solely on expanding the financial services business of American Express Co. Mr. Cracchiolo has been employed by American Express Company since 1982. He has been the Chairman of Ameriprise Financial Inc. since September 30, 2005. He served as Chairman of American Express Bank Ltd. since September 2000 & from March 2001 to April 2005. He has been Director of Ameriprise Financial Inc. since September 30, 2005. He serves on the Board of Advisors of March of Dimes. Mr.Cracchiolo served as a Director of Tech Data Corp. since 1999. Mr.Cracchiolo is a Certified Public Accountant and holds a B.S. Degree in Accounting and Economics and a Masters Degree in Business Administration with finance both Degrees from New York University School of Business. He served as Chairman and Chief Executive Officer of American Express Financial Advisor since March 2001 and previously served as its President and Chief Executive Officer since June 2000. Mr. Cracchiolo served as President and Chief Executive Officer of American Express International Inc. He served as President and Chief Executive Officer of American Express Travel Related Services Company Inc. from May 1998 to July 2003. Prior thereto he had been President, Global Network Services of American Express Travel Related Services Company, Inc. since February 1997. He is responsible for all of American Express' financial services businesses globally, as well as International Payments. Mr.Cracchiolo is currently assigned with the responsibility of focusing solely on expanding the financial services business of American Express Co. Mr. Cracchiolo has been employed by American Express Company since 1982. He has been the Chairman of Ameriprise Financial Inc. since September 30, 2005. He served as Chairman of American Express Bank Ltd. since September 2000 & from March 2001 to April 2005. He has been Director of Ameriprise Financial Inc. since September 30, 2005. He serves on the Board of Advisors of March of Dimes. Mr.Cracchiolo served as a Director of Tech Data Corp. since 1999. Mr.Cracchiolo is a Certified Public Accountant and holds a B.S. Degree in Accounting and Economics and a Masters Degree in Business Administration with finance both Degrees from New York University School of Business.","1099 Ameriprise Financial CenterMinneapolis, Minnesota 55474United States",American Express Company|Tech Data Corp.|New York University - Leonard N. Stern School of Business|New York University|Ameriprise National Trust Bank,Male,1958,,,Ameriprise Financial - Chief Executive Officer - ts_bot - Employment tenure | Ameriprise Financial - Chairman - ts_bot - Employment tenure | ,
Steven H. Collis,"Chief Executive Officer, President, Director and Chairman of Executive Committee,",AmerisourceBergen Corporation,University of the Witwatersrand,51,"$12,000,206 ",,2011,"Mr. Steven H. Collis, also know as Steve has been the Chief Executive Officer and President at AmerisourceBergen Corporation since July 2011. Previously, Mr. Collis served as the Chief Operating Officer of AmerisourceBergen Corporation from November 12, 2010 to July 2011. He served as the President of AmerisourceBergen Drug Corporation of AmerisourceBergen Corporation from September 1, 2009 to November 12, 2010. Prior to that, he served as Executive Vice President of ... Amerisourcebergen Corp., from September 18, 2007 to November 12, 2010. He served as President of AmerisourceBergen Specialty Group, a subsidiary of AmerisourceBergen Corp., based in Dallas, Texas from August 2001 to September 1, 2009. He served as Senior Vice President of Amerisourcebergen Corp. Mr. Collis served as Senior Vice President and President of ASD Specialty Healthcare Inc., was part of Bergen Brunswig Corporation. Mr. Collis served as Senior Executive Vice President of Bergen from February 2000 to August 2001 and President of ASD Specialty Healthcare Inc., a segment of Bergen Brunswig Corp., from September 2000 to August 2001. Mr. Collis served as Executive Vice President of ASD Specialty Healthcare Inc., from 1996 to August 2000 and General Manager from 1994 to 1996. He served as an Executive Vice President of Bergen Brunswig Corp. since February 2000. Prior to joining ASD, he was a Principal and served as General Manager of Sterling Medical in Irvine, California. He has completed his articles of clerkship with Price Waterhouse and received his Charter Accountancy license, the South African equivalent of Certified Public Accountant, in 1986. Prior to emigrating to the United States, Mr. Collis served as a Member of the Johannesburg Stock Exchange. Mr. Collis has been a Director of AmerisourceBergen Corp. since May 2011. He has been a Director at Thoratec Corp. since January 1, 2008. He serves as a Director of The Healthcare Distribution Management Association. He is an avid supporter of the American Cancer Society and other health-related charities. Mr. Collis earned a Bachelor of Commerce with Honors degree from University of the Witwatersrand in Johannesburg. Amerisourcebergen Corp., from September 18, 2007 to November 12, 2010. He served as President of AmerisourceBergen Specialty Group, a subsidiary of AmerisourceBergen Corp., based in Dallas, Texas from August 2001 to September 1, 2009. He served as Senior Vice President of Amerisourcebergen Corp. Mr. Collis served as Senior Vice President and President of ASD Specialty Healthcare Inc., was part of Bergen Brunswig Corporation. Mr. Collis served as Senior Executive Vice President of Bergen from February 2000 to August 2001 and President of ASD Specialty Healthcare Inc., a segment of Bergen Brunswig Corp., from September 2000 to August 2001. Mr. Collis served as Executive Vice President of ASD Specialty Healthcare Inc., from 1996 to August 2000 and General Manager from 1994 to 1996. He served as an Executive Vice President of Bergen Brunswig Corp. since February 2000. Prior to joining ASD, he was a Principal and served as General Manager of Sterling Medical in Irvine, California. He has completed his articles of clerkship with Price Waterhouse and received his Charter Accountancy license, the South African equivalent of Certified Public Accountant, in 1986. Prior to emigrating to the United States, Mr. Collis served as a Member of the Johannesburg Stock Exchange. Mr. Collis has been a Director of AmerisourceBergen Corp. since May 2011. He has been a Director at Thoratec Corp. since January 1, 2008. He serves as a Director of The Healthcare Distribution Management Association. He is an avid supporter of the American Cancer Society and other health-related charities. Mr. Collis earned a Bachelor of Commerce with Honors degree from University of the Witwatersrand in Johannesburg.","1300 Morris DriveChesterbrook, Pennsylvania 19087United States","Bergen Brunswig Corp.|Thoratec Corp.|AmerisourceBergen Drug Corporation|University of the Witwatersrand|Healthcare Distribution Management Association|AmerisourceBergen Specialty Group, Inc.",Male,,,,AmerisourceBergen - Executive Vice President - azierath - Employment tenure | AmeriSource Health Corporation - Executive Vice President - azierath - Employment tenure | Bergen Brunswig Corporation - President - azierath - Employment tenure | AmerisourceBergen Specialty Group - President - azierath - Employment tenure | Bergen Brunswig Corporation - 1994 - General Manager, ASD Specialty Healthcare - 1999 - azierath - Employment tenure | Sterling Medical - General Manager - azierath - Employment tenure | Bergen Brunswig Corporation - 1999 - President, ASD Specialty Healthcare - 2001 - azierath - Employment tenure | ,
Frank S. Hermance,"Chairman, Chief Executive Officer and Chairman of Executive Committee,",Ametek Inc.,Rochester Institute of Technology,64,"$6,720,705 ",,1999,"Mr. Frank S. Hermance has been Chief Executive Officer of AMETEK Inc., a Holding Company of PennEngineering Motion Technologies since September 1999. Mr. Hermance served as Chief Executive officer of Southern Aero Partners, Inc., since January 1, 2001. Previously, Mr. Hermance served in different roles at AMETEK Inc., where he served as Chief Executive Officer and served as its President from November 1996 to December 2000, Chief Operating Officer from January 1996 to ... September 1999 and Executive Vice President from January 1996 to November 1996. He served as President of Precision Instruments Group of AMETEK Inc. from 1994 to November 1996 and Group Vice President from 1990 to 1994. He served as General Manager of Tektronix's Waveform Measurement division. He served as Senior Vice President for Operations of Combustion Engineering's Taylor Instrument Company, a producer of analytical instruments. Mr. Hermance serves as Chairman of Ametek Specialty Metal Products and Drake Air, Inc. He serves as Chairman of Greater Philadelphia Alliance for Capital and Technologies. He served as Chairman of the Board of Manufacturers Alliance/MAPI, Inc. (AKA Manufacturers Alliance for Productivity and Innovation, Inc.). He has been the Chairman of AMETEK Inc. since January 1, 2001. He serves as a Trustee at Manufacturers Alliance/MAPI, Inc. Mr. Hermance serves as a Trustee of the Rochester Institute of Technology. He has been a Director of UGI Corporation since September, 2011. He serves as a Director of Ametek Specialty Metal Products, UGI Utilities, Inc. and Drake Air, Inc. He has been a Director of CTB International Corp. (AKA CTB, Inc.) since 1997. He has been a Director of Ametek Inc. since 1999. He served as a Director of IDEX Corp. since January 5, 2004. He has both a Master of Science in Electrical Engineering and a Bachelor of Science in Electrical Engineering from the Rochester Institute of Technology. September 1999 and Executive Vice President from January 1996 to November 1996. He served as President of Precision Instruments Group of AMETEK Inc. from 1994 to November 1996 and Group Vice President from 1990 to 1994. He served as General Manager of Tektronix's Waveform Measurement division. He served as Senior Vice President for Operations of Combustion Engineering's Taylor Instrument Company, a producer of analytical instruments. Mr. Hermance serves as Chairman of Ametek Specialty Metal Products and Drake Air, Inc. He serves as Chairman of Greater Philadelphia Alliance for Capital and Technologies. He served as Chairman of the Board of Manufacturers Alliance/MAPI, Inc. (AKA Manufacturers Alliance for Productivity and Innovation, Inc.). He has been the Chairman of AMETEK Inc. since January 1, 2001. He serves as a Trustee at Manufacturers Alliance/MAPI, Inc. Mr. Hermance serves as a Trustee of the Rochester Institute of Technology. He has been a Director of UGI Corporation since September, 2011. He serves as a Director of Ametek Specialty Metal Products, UGI Utilities, Inc. and Drake Air, Inc. He has been a Director of CTB International Corp. (AKA CTB, Inc.) since 1997. He has been a Director of Ametek Inc. since 1999. He served as a Director of IDEX Corp. since January 5, 2004. He has both a Master of Science in Electrical Engineering and a Bachelor of Science in Electrical Engineering from the Rochester Institute of Technology.","1100 Cassatt RoadBerwyn, Pennsylvania 19312United States","CTB, Inc.|HCC Industries, Inc.|IDEX Corporation|UGI Corporation|Atlas Material Testing Technology LLC|UGI Utilities Inc.|Rochester Institute of Technology|Manufacturers Alliance for Productivity and Innovation, Inc.|PennEngineering Motion Technologies|Southern Aero Partners, Inc.",Male,,,,AMETEK, Inc. - Chairman - ts_bot - Employment tenure | AMETEK, Inc. - Chief Executive Officer - ts_bot - Employment tenure | ,
