David D. Petratis,"Chairman, Chief Executive Officer and President,",Allegion Plc,Pepperdine University,55,--,,2013,"Mr. David D. Petratis, Dave has been Chairman of the Board, Chief Executive Officer and President of Allegion Plc since August 2013. Mr. Petratis has been a Vice President of Mikron Industries, Inc. since August 4, 2010. Mr. Petratis served as Interim President of Nichols Aluminum, LLC from June 2012 to July 2012. Mr. Petratis served as the Chairman of the Board of Quanex Building Products Corporation from December 4, 2008 to July 2013 and also served as its Chief Executive ... Officer and President from July 1, 2008 to July 2013. He also strengthened the culture around one brand, core values, health and safety. At Allegion, he focus on the interests of customers, employees and investors to grow and create lasting value for the and its shareholders. He held key leadership positions at Square D Company. He served as President and Chief Executive Officer for North American Operating Division of Juno Lighting LLC, a unit of Schneider Electric S.A. from January 2004 to July 2008. He served as the Executive Vice President of North American Operating Division of Schneider Electric S.A. from January 2004 to May 2008. Since December 2002, he served as the President and Chief Operating Officer of MGE UPS's U.S. operations, coordinating business activities with country managers in Mexico and Canada, with responsibility for U.S. manufacturing, advanced manufacturing, purchasing, quality, engineering, sales and marketing. He served as President of MGE Americas from 1996 to 2002. He joined Square D Lincoln, Nebraska (USA), circuit breaker manufacturing facility. From 1989 to 1993, he managed the Square D plant in Columbia, South Carolina. Since 1993, following the 1991 merger of Square D with Schneider Electric, Mr. Petratis served as Vice President of Operations of EPE Technologies. Since 1994, he served as President at EPE and two years later, he was part of its leveraged buyout of by Management and Financial Partners, resulting in the creation of MGE UPS Systems. Since 1986, he served as the youngest Plant Manager in Square D Lincoln's history at its Raleigh, North Carolina facility. He served as a Director of Quanex Building Products Corporation from July 1, 2008 to July 2013. He has been a Director of Gardner Denver Inc., since July 2004. He is a Board Member of Electrical Safety Foundation. Mr. Petratis serves on the Board of Governors of National Electrical Manufacturers Association (NEMA). He held positions on the Board of Directors of the University of California, Irvine Graduate School of Management and the California State (Fullerton) Quality Advisory Board and Project Independence. He was named Ernst & Young's Entrepreneur of the Year in 2000. Mr. Petratis holds BA in Industrial Management from University of Northern Iowa (USA) in 1981 and an MBA from Pepperdine University, Malibu, California (USA) in 1998. Officer and President from July 1, 2008 to July 2013. He also strengthened the culture around one brand, core values, health and safety. At Allegion, he focus on the interests of customers, employees and investors to grow and create lasting value for the and its shareholders. He held key leadership positions at Square D Company. He served as President and Chief Executive Officer for North American Operating Division of Juno Lighting LLC, a unit of Schneider Electric S.A. from January 2004 to July 2008. He served as the Executive Vice President of North American Operating Division of Schneider Electric S.A. from January 2004 to May 2008. Since December 2002, he served as the President and Chief Operating Officer of MGE UPS's U.S. operations, coordinating business activities with country managers in Mexico and Canada, with responsibility for U.S. manufacturing, advanced manufacturing, purchasing, quality, engineering, sales and marketing. He served as President of MGE Americas from 1996 to 2002. He joined Square D Lincoln, Nebraska (USA), circuit breaker manufacturing facility. From 1989 to 1993, he managed the Square D plant in Columbia, South Carolina. Since 1993, following the 1991 merger of Square D with Schneider Electric, Mr. Petratis served as Vice President of Operations of EPE Technologies. Since 1994, he served as President at EPE and two years later, he was part of its leveraged buyout of by Management and Financial Partners, resulting in the creation of MGE UPS Systems. Since 1986, he served as the youngest Plant Manager in Square D Lincoln's history at its Raleigh, North Carolina facility. He served as a Director of Quanex Building Products Corporation from July 1, 2008 to July 2013. He has been a Director of Gardner Denver Inc., since July 2004. He is a Board Member of Electrical Safety Foundation. Mr. Petratis serves on the Board of Governors of National Electrical Manufacturers Association (NEMA). He held positions on the Board of Directors of the University of California, Irvine Graduate School of Management and the California State (Fullerton) Quality Advisory Board and Project Independence. He was named Ernst & Young's Entrepreneur of the Year in 2000. Mr. Petratis holds BA in Industrial Management from University of Northern Iowa (USA) in 1981 and an MBA from Pepperdine University, Malibu, California (USA) in 1998.","Block DDublin, Co. Dublin 2Ireland","Juno Lighting, Inc.|Gardner Denver Inc.|Schneider Electric S.A.|Pepperdine University|University Of Northern Iowa|Mikron Industries, Inc.|Quanex Building Products Corporation|Nichols Aluminum, LLC",Male,,,,,
David E. I. Pyott,"Chairman and Chief Executive Officer,",Allergan Inc.,University of Edinburgh in Scotland,59,"$21,164,198 ",,1998,"Mr. David E. I. Pyott serves as the Chairman and Chief Executive Officer of Allergan Limited. Mr. Pyott has been the Chairman and Chief Executive Officer of Allergan Inc., a subsidiary of Allergan Medical S.A.R.L since April 2001 and January 1998 respectively. He serves as the President of the Pan-American Ophthalmological Foundation. He served as the President of Allergan Inc. from January 1998 to February 1, 2006 and from March 27, 2011 to June 2013 and as Chief Administrative ... Officer since August 1, 2010. He refocused Allergan's strategy on specialty pharmaceuticals as well as restructuring its worldwide operations. Mr. Pyott served as an Head of the Nutrition Division of Novartis AG from 1995 to December 1997. He served as the President and Chief Executive Officer of Sandoz Nutrition Corp., from 1992 to 1995 and served as its General Manager of Sandoz Nutrition, Barcelona, Spain from 1990 to 1992. He served in various positions within Sandoz Nutrition group from 1980. He has been a Director of Allergan Inc. since January 1998, MAP Pharmaceuticals, Inc. since March 1, 2013 and as an Independent Director of Edwards Lifesciences Corp. since 2000. He has been a Director at Avery Dennison Corporation since November 1999 and its Lead Independent Director since April 22, 2010. He serves as a Director of Pacific Mutual Holding Company and Pacific LifeCorp. He serves as a Director At Large of Biotechnology Industry Organization. He serves as a Member of the Board of Directors at EyeCare America. He served as a Director of Abbott Medical Optics Inc. from October 2001 to June 29, 2003. Mr. Pyott is the Chairman of the California Healthcare Institute. He is Vice Chair of the Chief Executive Roundtable for UCI. He is a Member of the Board of Directors of the Pharmaceutical Research and Manufacturers of America. Mr. Pyott is a Member of the Board of Directors of the International Council of Ophthalmology Foundation. He is a Member of the Directors' Board of the University of California (Irvine) Graduate School of Management. Mr. Pyott holds a Diploma in German and European Law from the Europa Institute at the University of Amsterdam, a Master of Arts degree from the University of Edinburgh, and an MBA from the London Business School. Officer since August 1, 2010. He refocused Allergan's strategy on specialty pharmaceuticals as well as restructuring its worldwide operations. Mr. Pyott served as an Head of the Nutrition Division of Novartis AG from 1995 to December 1997. He served as the President and Chief Executive Officer of Sandoz Nutrition Corp., from 1992 to 1995 and served as its General Manager of Sandoz Nutrition, Barcelona, Spain from 1990 to 1992. He served in various positions within Sandoz Nutrition group from 1980. He has been a Director of Allergan Inc. since January 1998, MAP Pharmaceuticals, Inc. since March 1, 2013 and as an Independent Director of Edwards Lifesciences Corp. since 2000. He has been a Director at Avery Dennison Corporation since November 1999 and its Lead Independent Director since April 22, 2010. He serves as a Director of Pacific Mutual Holding Company and Pacific LifeCorp. He serves as a Director At Large of Biotechnology Industry Organization. He serves as a Member of the Board of Directors at EyeCare America. He served as a Director of Abbott Medical Optics Inc. from October 2001 to June 29, 2003. Mr. Pyott is the Chairman of the California Healthcare Institute. He is Vice Chair of the Chief Executive Roundtable for UCI. He is a Member of the Board of Directors of the Pharmaceutical Research and Manufacturers of America. Mr. Pyott is a Member of the Board of Directors of the International Council of Ophthalmology Foundation. He is a Member of the Directors' Board of the University of California (Irvine) Graduate School of Management. Mr. Pyott holds a Diploma in German and European Law from the Europa Institute at the University of Amsterdam, a Master of Arts degree from the University of Edinburgh, and an MBA from the London Business School.","2525 Dupont DriveIrvine, California 92612United States","Pacific Mutual Holding Company|Pacific LifeCorp|Avery Dennison Corporation|Edwards Lifesciences Corp.|Allergan Medical S.A.R.L|Abbott Medical Optics Inc.|Biotechnology Industry Organization|London Business School|University of Edinburgh in Scotland|MAP Pharmaceuticals, Inc.|Allergan Limited",Male,,,,Allergan - Chairman - ts_bot - Employment tenure | Allergan - Chief Executive Officer - ts_bot - Employment tenure | ,
Edward J. Heffernan,"Chief Executive Officer, President, Director and Member of Executive Committee,",Alliance Data Systems Corporation,Columbia Business School,50,"$6,959,844 ",,2009,"Mr. Edward J. Heffernan, also known as Ed, has been the Chief Executive Officer and President of Alliance Data Systems Corporation since June, 2009. Mr. Heffernan served as the Chief Financial Officer and Executive Vice President of Alliance Data Systems, Inc., since May 2000 until March 2009. and, prior to that, he was responsible for mergers and acquisitions for Alliance Data. He joined Alliance Data Systems Corporation in May 1998 He served as Vice President of Mergers ... and Acquisitions for First Data Corporation from October 1994 to May 1998. Prior to that, Mr. Heffernan served as Vice President of Mergers and Acquisitions for CitiCorp. from July 1990 to October 1994. He began his career in the Corporate Finance group at Credit Suisse First Boston Corporation, where he served from June 1986 to July 1990. He has been a Director of Valor Telecommunications, L.L.C. since May 2005 and Alliance Data Systems Corporation since June 2009. He served as a Director of Valor Communications Group Inc. since May 2, 2005. Mr. Heffernan holds a Bachelor's degree from Wesleyan University and an MBA from Columbia Business School. and Acquisitions for First Data Corporation from October 1994 to May 1998. Prior to that, Mr. Heffernan served as Vice President of Mergers and Acquisitions for CitiCorp. from July 1990 to October 1994. He began his career in the Corporate Finance group at Credit Suisse First Boston Corporation, where he served from June 1986 to July 1990. He has been a Director of Valor Telecommunications, L.L.C. since May 2005 and Alliance Data Systems Corporation since June 2009. He served as a Director of Valor Communications Group Inc. since May 2, 2005. Mr. Heffernan holds a Bachelor's degree from Wesleyan University and an MBA from Columbia Business School.","7500 Dallas ParkwayPlano, Texas 75024United States","Valor Telecommunications, LLC|ADS Alliance Data Systems, Inc.|Columbia Business School|Wesleyan University|Valor Communications Group Inc.",Male,,,,Alliance Data Systems Corporation - Executive Vice President - ts_bot - Employment tenure | Alliance Data Systems Corporation - Chief Financial Officer - ts_bot - Employment tenure | ,
Martin J. Barrington,"Chairman, Chief Executive Officer and Chairman of Executive Committee,",Altria Group Inc.,"Albany Law School Inc, The",59,"$12,121,929 ",,2012,"Mr. Martin J. Barrington, also known as Marty has been the Chief Executive Officer and Chairman of the Board of Altria Group Inc. since May 17, 2012 Mr. Barrington served as the President and Chief Operating Officer of Altria Group Inc. until May 17, 2012. Mr. Barrington served as an Executive Vice President and Chief Compliance and Administrative Officer of Altria Group, Inc. He led Compliance & Brand Integrity, Corporate Communications, Corporate Responsibility & Stakeholder ... Engagement, Government Affairs and Human Resources groups of Altria. He served as a Senior Vice President and General Counsel of Philip Morris International Management SA since 1998. He joined Philip Morris International Management SA in August 2003. His almost 25-year legal career began with United States government service, followed by 11 years of private firm practice. He joined Philip Morris USA in 1993 and in 1998, became Senior Vice President, General Counsel and Corporate Secretary. He served as a Vice President and Associate General Counsel of Altria Group Inc. Before joining the Altria family in 1993, he practiced law in both the government and private sectors. He has been the Vice Chairman of Altria Group Inc. since January 26, 2012. He serves as a Director at Altria Group Inc. He served a Member of board of Commissioner at Virginia Port Authority until July 2010. Mr. Barrington has an undergraduate degree in history and political science and was awarded his law degree by Albany Law School. Engagement, Government Affairs and Human Resources groups of Altria. He served as a Senior Vice President and General Counsel of Philip Morris International Management SA since 1998. He joined Philip Morris International Management SA in August 2003. His almost 25-year legal career began with United States government service, followed by 11 years of private firm practice. He joined Philip Morris USA in 1993 and in 1998, became Senior Vice President, General Counsel and Corporate Secretary. He served as a Vice President and Associate General Counsel of Altria Group Inc. Before joining the Altria family in 1993, he practiced law in both the government and private sectors. He has been the Vice Chairman of Altria Group Inc. since January 26, 2012. He serves as a Director at Altria Group Inc. He served a Member of board of Commissioner at Virginia Port Authority until July 2010. Mr. Barrington has an undergraduate degree in history and political science and was awarded his law degree by Albany Law School.","6601 West Broad StreetRichmond, Virginia 23230United States","Philip Morris International Management S.A.|Albany Law School Inc, The|Virginia Port Authority",Male,,,,Altria - Executive Vice President and Chief Administrative Officer - alden - Employment tenure | Altria - Chief compliance officer - alden - Employment tenure | Altria - Vice President and Associate General Counsel - alden - Employment tenure | Philip Morris International - 1998 - Senior Vice President and General Counsel - alden - Employment tenure | Philip Morris USA - 1998 - Senior Vice President, General Counsel  and Corporate Secretary - alden - Employment tenure | Philip Morris USA - Executive Vice President, Corporate Responsibility - alden - Employment tenure | Philip Morris USA - 1993 - alden - Employment tenure | ,
Thomas R. Voss,"Chairman and Chief Executive Officer,",Ameren Corporation,"University of Missouri, Rolla",65,"$6,038,282 ",,2010,"Mr. Thomas R. Voss, also known as Tom, has been the Chairman of the Board of Ameren Corporation since April 27, 2010 and has been its Chief Executive Officer since May 1, 2009. Mr. Voss served as the President of Ameren Corporation from May 1, 2009 to February 14, 2014. Mr. Voss served as the Chief Executive Officer and President of AmerenUE since January 1, 2006. He served as an Executive Vice President and Chief Operating Officer of Ameren Corporation, the holding ... company of AmerenIP from January 1, 2005 to April 30, 2009. Mr. Voss served as the Chief Executive Officer and President of Union Electric Company, a subsidiary of at Ameren Corporation from January 1, 2007 to 2009. He has 40 years of experience. Since October 2003, he served as President of Resources Company, and Medina Valley. He served as the President of Marketing Company, AFS and AERG from October 2003 to October 2004. He served as an Executive Vice President of AmerenIP from May 2006 to April 24, 2007. Mr. Voss served as Chief Operating Officer of Central Illinois Light Co. until April 2007 and served as its Executive Vice President from May 2006 to April 2007. He served as Senior Vice President of Central Illinois Light Company (CILCO) since January 31, 2003. He served as President of Ameren Energy Generating Company, a subsidiary of Ameren Corp. since October 2003 and served as its Principal Executive Officer and Chief Operating Officer. He served as an Executive Vice President of Ameren Energy Generating Company since 2001. He served as Senior Vice President of Ameren Services Company, a subsidiary of Ameren Corp. since June 1, 1999 and of Ameren Energy Generating Company (AEG) since 2001. He served as Senior Vice President of Central Illinois Public Service Company (CIPS) (AKA Ameren Illinois Company), a subsidiary of Ameren Corp. from June 1, 1999 to May 2006 and served as its Executive Vice President since May 2006. Mr. Voss served as Vice President of CIPS since 1998. He served as an Executive Vice President of CILCORP Inc. from May 2006 to April 2007, Chief Operating Officer from January 1, 2007 to April 2007 and Senior Vice President since January 31, 2003. He served as President of Genco from October 2003 to October 2004. He served as Senior Vice President of Generation of Ameren of Illinois Power Co. Mr. Voss served as an Executive Vice President of Union Electric Company from May 2006 to January 1, 2007, Senior Vice President since June 1, 1999 and also served as its Chief Operating Officer. He served as the Vice President of Union Electric Co., since June 1, 1999, where he began his career in 1969 as an Engineer. He served for four years in military service. From 1975 to 1988, he served various positions including District Manager and Distribution Operating Manager of Union Electric. He has been the Chairman of the Board at St. Louis Regional Chamber & Growth Association since January 2011. He served as the Chairman of Union Electric Company from January 1, 2007 to 2009. He served as the Chairman of Chairman of AmerenUE. He served as a Director of Ameren Corporation since April 28, 2009. He served as a Director of AmerenIP. He served as a Director of CILCORP Inc. since January 31, 2003. He served as a Director of Ameren Corporation and AmerenUE. He served as a Director of Union Electric from October 25, 2001 to 2009. He served as a Director of Central Illinois Light Company since 2003 and Central Illinois Public Service Company from October 12, 2001 to 2007. He served as a Director of Ameren Energy Generating Company since October 2003. He is a registered Professional Engineer in Missouri and Illinois. Mr. Voss holds a Bachelor's degree in Electrical Engineering from the University of Missouri-Rolla. Mr. Voss graduated form the University of Michigan's Public Utility Executive Program and the Westinghouse Advanced Power Systems School in Pittsburgh. company of AmerenIP from January 1, 2005 to April 30, 2009. Mr. Voss served as the Chief Executive Officer and President of Union Electric Company, a subsidiary of at Ameren Corporation from January 1, 2007 to 2009. He has 40 years of experience. Since October 2003, he served as President of Resources Company, and Medina Valley. He served as the President of Marketing Company, AFS and AERG from October 2003 to October 2004. He served as an Executive Vice President of AmerenIP from May 2006 to April 24, 2007. Mr. Voss served as Chief Operating Officer of Central Illinois Light Co. until April 2007 and served as its Executive Vice President from May 2006 to April 2007. He served as Senior Vice President of Central Illinois Light Company (CILCO) since January 31, 2003. He served as President of Ameren Energy Generating Company, a subsidiary of Ameren Corp. since October 2003 and served as its Principal Executive Officer and Chief Operating Officer. He served as an Executive Vice President of Ameren Energy Generating Company since 2001. He served as Senior Vice President of Ameren Services Company, a subsidiary of Ameren Corp. since June 1, 1999 and of Ameren Energy Generating Company (AEG) since 2001. He served as Senior Vice President of Central Illinois Public Service Company (CIPS) (AKA Ameren Illinois Company), a subsidiary of Ameren Corp. from June 1, 1999 to May 2006 and served as its Executive Vice President since May 2006. Mr. Voss served as Vice President of CIPS since 1998. He served as an Executive Vice President of CILCORP Inc. from May 2006 to April 2007, Chief Operating Officer from January 1, 2007 to April 2007 and Senior Vice President since January 31, 2003. He served as President of Genco from October 2003 to October 2004. He served as Senior Vice President of Generation of Ameren of Illinois Power Co. Mr. Voss served as an Executive Vice President of Union Electric Company from May 2006 to January 1, 2007, Senior Vice President since June 1, 1999 and also served as its Chief Operating Officer. He served as the Vice President of Union Electric Co., since June 1, 1999, where he began his career in 1969 as an Engineer. He served for four years in military service. From 1975 to 1988, he served various positions including District Manager and Distribution Operating Manager of Union Electric. He has been the Chairman of the Board at St. Louis Regional Chamber & Growth Association since January 2011. He served as the Chairman of Union Electric Company from January 1, 2007 to 2009. He served as the Chairman of Chairman of AmerenUE. He served as a Director of Ameren Corporation since April 28, 2009. He served as a Director of AmerenIP. He served as a Director of CILCORP Inc. since January 31, 2003. He served as a Director of Ameren Corporation and AmerenUE. He served as a Director of Union Electric from October 25, 2001 to 2009. He served as a Director of Central Illinois Light Company since 2003 and Central Illinois Public Service Company from October 12, 2001 to 2007. He served as a Director of Ameren Energy Generating Company since October 2003. He is a registered Professional Engineer in Missouri and Illinois. Mr. Voss holds a Bachelor's degree in Electrical Engineering from the University of Missouri-Rolla. Mr. Voss graduated form the University of Michigan's Public Utility Executive Program and the Westinghouse Advanced Power Systems School in Pittsburgh.","1901 Chouteau AvenueSt. Louis, Missouri 63103United States","CILCORP Inc.|Union Electric Company|Ameren Illinois Company|Illinois Power Generating Company|AmerenIP|Central Illinois Light Company|University of Missouri, Rolla|St. Louis Regional Chamber & Growth Association|College of Engineering, Pennstate",Male,,,,,
