Richard A. Gonzalez,"Chairman, Chief Executive Officer and Chairman of Executive Committee,",AbbVie Inc.,,59,"$7,949,217 ",,2010,"Mr. Richard A. Gonzalez, also known as Rick serves as the Chairman and Chief Executive Officer at AbbVie Inc. Mr. Gonzalez has been an Executive Vice President of Pharmaceutical Products Group at Abbott Diabetes Care Inc., since July 1, 2010. He was President of Abbott Ventures, Inc. at Abbott Diabetes Care, Inc. since 2009. He served as an Interim Executive Vice President of Pharmaceutical Products at Abbott Laboratories since July 1, 2010. He was responsible for Abbott's ... global pharmaceutical business, including commercial operations, research and development, and manufacturing. He has served more than 30 years in various capacities at Abbott. He served as President, Abbott Ventures Inc., Abbott's medical technology investment arm, from 2009 to 2011. Mr. Gonzalez joined Abbott in 1977 and held various management positions before briefly retiring in 2007, including President of Abbott's Medical Products Group, and President of Abbott's former Hospital Products Division (now Hospira, Inc.). He served as Chief Operating Officer and President of Abbott Vascular, Inc., a subsidiary of Abbott Laboratories until September 30, 2007. He served as an Executive Vice President of medical products of Abbott from 2000 to 2001, as Senior Vice President, hospital products from 1998 to 2000, and as Vice President of Abbott Health Systems division from 1995 to 1998. He served as President of Abbott's Health Systems Division. He joined Abbott in 1977. Since 1992, he served as Divisional Vice President and General Manager for Abbott's Diagnostic Operations in the United States and Canada. He served as a Chief Operating Officer & President of Abbott Laboratories from 2006 to September 30, 2007, served as its Chief Operating Officer of Medical Products Group and President of Medical Products Group-div from 2001 to March 27, 2006, President from 2006 to September 30, 2007, Chief Operating Officer of all Operations and President of All Operations since March 27, 2006. Prior to Abbott, Mr. Gonzalez served as a research biochemist at the University of Miami School of Medicine. He serves on the board of Directors of the John G. Shedd Aquarium and the Lyric Opera of Chicago. He served as a Director of Abbott Vascular, Inc. until September 30, 2007 and Abbott Laboratories from December 14, 2001 to September 30, 2007. global pharmaceutical business, including commercial operations, research and development, and manufacturing. He has served more than 30 years in various capacities at Abbott. He served as President, Abbott Ventures Inc., Abbott's medical technology investment arm, from 2009 to 2011. Mr. Gonzalez joined Abbott in 1977 and held various management positions before briefly retiring in 2007, including President of Abbott's Medical Products Group, and President of Abbott's former Hospital Products Division (now Hospira, Inc.). He served as Chief Operating Officer and President of Abbott Vascular, Inc., a subsidiary of Abbott Laboratories until September 30, 2007. He served as an Executive Vice President of medical products of Abbott from 2000 to 2001, as Senior Vice President, hospital products from 1998 to 2000, and as Vice President of Abbott Health Systems division from 1995 to 1998. He served as President of Abbott's Health Systems Division. He joined Abbott in 1977. Since 1992, he served as Divisional Vice President and General Manager for Abbott's Diagnostic Operations in the United States and Canada. He served as a Chief Operating Officer & President of Abbott Laboratories from 2006 to September 30, 2007, served as its Chief Operating Officer of Medical Products Group and President of Medical Products Group-div from 2001 to March 27, 2006, President from 2006 to September 30, 2007, Chief Operating Officer of all Operations and President of All Operations since March 27, 2006. Prior to Abbott, Mr. Gonzalez served as a research biochemist at the University of Miami School of Medicine. He serves on the board of Directors of the John G. Shedd Aquarium and the Lyric Opera of Chicago. He served as a Director of Abbott Vascular, Inc. until September 30, 2007 and Abbott Laboratories from December 14, 2001 to September 30, 2007.","1 North Waukegan RoadNorth Chicago, Illinois 60064United States",Abbott Laboratories|Abbott Vascular Inc.|Abbott Ventures Inc.,Male,,,,Abbott Laboratories - President - ts_bot - Employment tenure | Abbott Laboratories - Chief Operating Officer - ts_bot - Employment tenure | ,
Daniel P. Amos,"Chairman, Chief Executive Officer and Chairman of Executive Committee,",AFLAC Inc.,University of Georgia,61,"$13,818,362 ",,1990,"Mr. Daniel P. Amos, also known as Dan, has been Chief Executive Officer of AFLAC Inc. since 1990. Mr. Amos has been the Chief Executive Officer of American Family Life Assurance Company of New York, principal subsidiary of AFLAC since August 1990. He serves as the Chairman of the Board and Chief Executive Officer of American Family Life Assurance Company of Columbus. Mr. Amos served as President of AFLAC until May 2001. Mr. Amos has been Chairman of American Family Life ... Assurance Company of New York since May 2001. Mr. Amos has been the Chairman of AFLAC since May 2001 and Director since 1983. He serves as a Director of American Family Life Assurance Company of New York. He served as Director of Synovus Financial Corp., since 2001 and previously served as its Director from 1991 to 1998. He served as a Director of Southern Co. from 2000 to February 2006. He served as a Director of CIT Group Inc., since January 1998 and Georgia Power Co. since May 1997. He was Chairman of the board of The Japan America Society of Georgia and was the Chairman of the University of Georgia Foundation. He is a Member of the Board of Trustees of Children's Healthcare of Atlanta and House of Mercy of Columbus. Mr. Amos has received the Dr. Martin Luther King Jr. Unity Award and the Anti-Defamation League's Torch of Liberty Award. In January 2005, Mr. Amos was named as one of the Best CEOs within the insurance/life category by Institutional Investor Magazine for the third consecutive year. Mr. Amos holds a Degree from University of Georgia in Risk Management and Insurance. Assurance Company of New York since May 2001. Mr. Amos has been the Chairman of AFLAC since May 2001 and Director since 1983. He serves as a Director of American Family Life Assurance Company of New York. He served as Director of Synovus Financial Corp., since 2001 and previously served as its Director from 1991 to 1998. He served as a Director of Southern Co. from 2000 to February 2006. He served as a Director of CIT Group Inc., since January 1998 and Georgia Power Co. since May 1997. He was Chairman of the board of The Japan America Society of Georgia and was the Chairman of the University of Georgia Foundation. He is a Member of the Board of Trustees of Children's Healthcare of Atlanta and House of Mercy of Columbus. Mr. Amos has received the Dr. Martin Luther King Jr. Unity Award and the Anti-Defamation League's Torch of Liberty Award. In January 2005, Mr. Amos was named as one of the Best CEOs within the insurance/life category by Institutional Investor Magazine for the third consecutive year. Mr. Amos holds a Degree from University of Georgia in Risk Management and Insurance.","1932 Wynnton RoadColumbus, Georgia 31999United States","Southern Company|Synovus Financial Corporation|Georgia Power Co.|CIT Group Inc.|University of Georgia|American Family Life Assurance Company of Columbus|American Family Life Assurance Company of New York|Aflac International, Incorporated|AFLAC Japan",Male,1951-08-13,Pensacola,,Aflac - Chief Executive Officer - ts_bot - Employment tenure | Aflac - Chairman - ts_bot - Employment tenure | ,
John W. Somerhalder II,"Chairman, Chief Executive Officer, President, Member of Executive Committee and Member of Finance & Risk Management Committee,",AGL Resources Inc.,The University of Arizona,57,"$4,592,954 ",,2006,"Mr. John W. Somerhalder, II has been Chief Executive Officer and President of AGL Resources Inc. of Sequent Energy Management, L.P. since March 2, 2006. Mr. Somerhalder served as the Chief Executive Officer of Colorado Interstate Gas Co. He served as a Principal Executive Officer of Southern Natural Gas Co. He served as Chief Executive Officer of El Paso Natural Gas Co. He served as the President and Chief Executive Officer of Tennessee Gas Pipeline Co. (TGP) from 1996 ... to 1999. He spent almost 30 years with El Paso Corporation and its predecessor entities rising through the ranks from engineer in 1977 to corporate executive. He served as the President of El Paso Pipeline Group of El Paso Marketing L.P. from January 2001 to April 30, 2005. Mr. Somerhalder served as Principal Executive Officer and Chairman of ANR Pipeline Co. He served as an Executive Vice President of El Paso Corp. from April 2000 to April 30, 2005 and President of Pipelines segment of El Paso Corporation from January 2001 to April 30, 2005. He served as an Executive Vice President of San Juan Basin of New Mexico since April 2000. He served as the President of TGP from December 1996 to January 2000, El Paso Energy Resources Company, a subsidiary of El Paso Corporation from April 1996 to December 1996 and Senior Vice President of El Paso Corporation from August 1992 to April 1996. From 1992 to 1996, Mr. Somerhalder served as the Senior Vice President of Operations and Engineering at El Paso Natural Gas Company. From 1977 to 1990, he held various other positions at El Paso Corporation and its subsidiaries until being named an officer in 1990. From 1990 to 1992, Mr. Somerhalder served as Vice President of Engineering at El Paso Natural Gas Company. He has been the Chairman of AGL Resources Inc. since October 31, 2007. He served as the Chairman of Colorado Interstate Gas Co. since January 2001, Southern Natural Gas Co. from January 2000 to April 30, 2005, El Paso Natural Gas Co., and Tennessee Gas Pipeline Co from January 2000 to April 30, 2005. He has been First Vice Chairman of American Gas Association since January 2010 and served as its Second Vice Chairman. He has been a Director of Inergy GP, LLC since October 7, 2013. Mr. Somerhalder has been a Director for Crestwood Gas Services GP LLC (formerly Quicksilver Gas Services GP LLC), General Partner of Crestwood Midstream Partners LP since July 2007. He serves as a Trustee of Georgia Research Alliance, Inc. He has been a Director of AGL Resources Inc. since March 2, 2006. He serves as a Director of Northern Illinois Gas Company and ANR Pipeline Co. and Gas Technology Institute. He served as Director of Colorado Interstate Gas Co. He served as Presiding Director of Non Management Executive Sessions for Quicksilver Gas Services GP LLC - General Partner at Quicksilver Gas Services LP. He served as a Director of Southern Natural Gas Co. (SNG), Tennessee Gas Pipeline Co. and El Paso Natural Gas Co. (EPNG), subsidiaries of El Paso Corp. until April 30, 2005. Mr. Somerhalder holds a Bachelor of Science degree in chemical engineering from the University of Arizona. to 1999. He spent almost 30 years with El Paso Corporation and its predecessor entities rising through the ranks from engineer in 1977 to corporate executive. He served as the President of El Paso Pipeline Group of El Paso Marketing L.P. from January 2001 to April 30, 2005. Mr. Somerhalder served as Principal Executive Officer and Chairman of ANR Pipeline Co. He served as an Executive Vice President of El Paso Corp. from April 2000 to April 30, 2005 and President of Pipelines segment of El Paso Corporation from January 2001 to April 30, 2005. He served as an Executive Vice President of San Juan Basin of New Mexico since April 2000. He served as the President of TGP from December 1996 to January 2000, El Paso Energy Resources Company, a subsidiary of El Paso Corporation from April 1996 to December 1996 and Senior Vice President of El Paso Corporation from August 1992 to April 1996. From 1992 to 1996, Mr. Somerhalder served as the Senior Vice President of Operations and Engineering at El Paso Natural Gas Company. From 1977 to 1990, he held various other positions at El Paso Corporation and its subsidiaries until being named an officer in 1990. From 1990 to 1992, Mr. Somerhalder served as Vice President of Engineering at El Paso Natural Gas Company. He has been the Chairman of AGL Resources Inc. since October 31, 2007. He served as the Chairman of Colorado Interstate Gas Co. since January 2001, Southern Natural Gas Co. from January 2000 to April 30, 2005, El Paso Natural Gas Co., and Tennessee Gas Pipeline Co from January 2000 to April 30, 2005. He has been First Vice Chairman of American Gas Association since January 2010 and served as its Second Vice Chairman. He has been a Director of Inergy GP, LLC since October 7, 2013. Mr. Somerhalder has been a Director for Crestwood Gas Services GP LLC (formerly Quicksilver Gas Services GP LLC), General Partner of Crestwood Midstream Partners LP since July 2007. He serves as a Trustee of Georgia Research Alliance, Inc. He has been a Director of AGL Resources Inc. since March 2, 2006. He serves as a Director of Northern Illinois Gas Company and ANR Pipeline Co. and Gas Technology Institute. He served as Director of Colorado Interstate Gas Co. He served as Presiding Director of Non Management Executive Sessions for Quicksilver Gas Services GP LLC - General Partner at Quicksilver Gas Services LP. He served as a Director of Southern Natural Gas Co. (SNG), Tennessee Gas Pipeline Co. and El Paso Natural Gas Co. (EPNG), subsidiaries of El Paso Corp. until April 30, 2005. Mr. Somerhalder holds a Bachelor of Science degree in chemical engineering from the University of Arizona.","Ten Peachtree Place NEAtlanta, Georgia 30309United States","El Paso Marketing Company, L.L.C.|Gas Technology Institute|El Paso Natural Gas Company, L.L.C|El Paso LLC|Southern Natural Gas Company, LLC|ANR Pipeline Company|Tennessee Gas Pipeline Company, L.L.C.|Colorado Interstate Gas Company, L.L.C.|Northern Illinois Gas Company|The University of Arizona|American Gas Association|Sequent Energy Management, L.P.|Crestwood Midstream Partners LP|Inergy GP, LLC|Crestwood Equity Partners LP|Georgia Research Alliance, Inc.",Male,,,,AGL Resources - Chief Executive Officer - ts_bot - Employment tenure | AGL Resources - President - ts_bot - Employment tenure | ,
John E. McGlade,"Chairman, Chief Executive Officer, President and Chairman of Executive Committee,",Air Products & Chemicals Inc.,Lehigh University,59,"$9,976,558 ",,2007,"Mr. John E. McGlade has been Chief Executive Officer and President of Air Products Singapore Pte. Ltd. since October 2007 and has been its Chairman of the Board since April 2008. Mr. McGlade focuses on setting the strategy and policies of Air Products, developing leadership, and meeting shareholder commitments. Mr. McGlade has been the Chairman of Air Products & Chemicals Inc. since April 1, 2008 and has been its Chief Executive Officer since October 1, 2007. Mr. McGlade ... has been President of Air Products & Chemicals Inc. since October 1, 2006. He served as a Group Vice President of Chemicals, Group Business Divisions of Air Products & Chemicals Inc., from November 1, 2003 to October 1, 2006. He was responsible for the global Chemicals organization of Air Products, including the Performance Materials and Industrial Chemicals Divisions, and international chemicals commercial operations in Asia, Europe and Latin America. He served as the Chief Operating Officer of Air Products & Chemicals Inc. since October 1, 2006. Mr. McGlade joined Air Products in 1976 as a Participant in Air Products' Career Development Program and held various positions within the Industrial Gases Division, including both domestic and international assignments. He served as General Manager of the Chemical and Process Industries Division of Air Products' Career Development Program since 1994 and served as its Vice President of the Division since 1996. He served as Vice President and General Manager of Chemical and Process Industries, Energy Systems since 1998, Vice President and General Manager of Performance Materials Division since 2001 and served as Vice President of Chemicals Group business divisions since 2003. Mr. McGlade has been a Director of Air Products & Chemicals Inc., since May 17, 2007. He has been a Director of The Goodyear Tire & Rubber Company since December 4, 2012. He serves as a Director of the American Chemistry Council. He serves as a Member of the Society of Chemical Industry. He serves as a Member of the Lehigh University Board of Trustees. Mr. McGlade holds a BS in Industrial Engineering from Lehigh University and an MBA from Lehigh University. has been President of Air Products & Chemicals Inc. since October 1, 2006. He served as a Group Vice President of Chemicals, Group Business Divisions of Air Products & Chemicals Inc., from November 1, 2003 to October 1, 2006. He was responsible for the global Chemicals organization of Air Products, including the Performance Materials and Industrial Chemicals Divisions, and international chemicals commercial operations in Asia, Europe and Latin America. He served as the Chief Operating Officer of Air Products & Chemicals Inc. since October 1, 2006. Mr. McGlade joined Air Products in 1976 as a Participant in Air Products' Career Development Program and held various positions within the Industrial Gases Division, including both domestic and international assignments. He served as General Manager of the Chemical and Process Industries Division of Air Products' Career Development Program since 1994 and served as its Vice President of the Division since 1996. He served as Vice President and General Manager of Chemical and Process Industries, Energy Systems since 1998, Vice President and General Manager of Performance Materials Division since 2001 and served as Vice President of Chemicals Group business divisions since 2003. Mr. McGlade has been a Director of Air Products & Chemicals Inc., since May 17, 2007. He has been a Director of The Goodyear Tire & Rubber Company since December 4, 2012. He serves as a Director of the American Chemistry Council. He serves as a Member of the Society of Chemical Industry. He serves as a Member of the Lehigh University Board of Trustees. Mr. McGlade holds a BS in Industrial Engineering from Lehigh University and an MBA from Lehigh University.","7201 Hamilton BoulevardAllentown, Pennsylvania 18195United States",The Goodyear Tire & Rubber Company|Lehigh University|Air Products Singapore Pte. Ltd.,Male,1954,Pennsylvania,United States of America | ,Air Products & Chemicals - 2007-10 - President - ts_bot - Employment tenure | Air Products & Chemicals - 2007-10 - Chief Operating Officer - ts_bot - Employment tenure | ,
Richard J. Harshman,"Chairman, Chief Executive Officer and President,",Allegheny Technologies Inc.,Robert Morris University,57,"$10,172,331 ",,2011,"Mr. Richard J. Harshman, also known as Rich, has been the Chairman Chief Executive Officer of Allegheny Technologies Inc. (ATI) since May 1, 2011 and its President since August 1, 2010. Mr. Harshman served as the Chief Operating Officer of Allegheny Technologies Inc. since August 1, 2010. Mr. Harshman served as an Executive Vice President for Finance of Allegheny Technologies Inc. from October 21, 2003 to August 1, 2010 and served as its Chief Financial Officer from ... December 2000 to August 1, 2010. Mr. Harshman served as Head of shared services, including procurement and information technologies of Allegheny Technologies Inc. since October 21, 2003. Mr. Harshman was responsible for all accounting, financial, treasury, tax, and internal audit functions and for investor relations. He joined Teledyne, Inc. (a predecessor company to ATI) as a Member of the Corporate Internal Audit Department in 1978, and served in increasingly important roles at both the corporate and operating levels. Mr. Harshman served as Senior Vice President for Finance of Allegheny Technologies Inc. from December 2001 to October 2003 and served as its Vice President for Finance and Chief Financial Officer from December 2000 to December 2001. From September 2000 to December 2000, Mr. Harshman served as Vice President, Controller and Acting Chief Financial Officer of Allegheny Technologies Inc. Previously, he served as Vice President for Investor Relations and Corporate Communications at Allvac since July 1998, and served as Senior Vice President for Finance and Administration from 1995. He has been a Director of Ameren Corporation since June 2013. He has been Vice Chair of Allegheny Conference On Community Development since January 01, 2014. He serves as vice chairman of the board of trustees at Robert Morris University. He is a Member of the board of directors of the National Association of Manufacturers. He is a member of the board of directors of the Laurel Highlands Council, Boy Scouts of America (Greater Pittsburgh Area). He is also a member of the Chairman's Council of the Pittsburgh Symphony Orchestra and the Pittsburgh Cultural Trust Board of Trustees. He was a Director of the Ethics and Compliance Officer Association. He has received many accolades, including being named one of the Most Influential People in Business of 2011 by the Pittsburgh Post-Gazette. He was also honored with the Best CFO Award in 2008 by Institutional Investor and named 2008 CFO of the Year (public company category) by the Pittsburgh Business Times. He is active in various charitable and Civic Organizations including the United Way and the Challenger Baseball Program for children with special needs. Mr. Harshman achieved his Certified Public Accountant's certificate in 1985 and holds a Bachelor of Science degree from Robert Morris University. December 2000 to August 1, 2010. Mr. Harshman served as Head of shared services, including procurement and information technologies of Allegheny Technologies Inc. since October 21, 2003. Mr. Harshman was responsible for all accounting, financial, treasury, tax, and internal audit functions and for investor relations. He joined Teledyne, Inc. (a predecessor company to ATI) as a Member of the Corporate Internal Audit Department in 1978, and served in increasingly important roles at both the corporate and operating levels. Mr. Harshman served as Senior Vice President for Finance of Allegheny Technologies Inc. from December 2001 to October 2003 and served as its Vice President for Finance and Chief Financial Officer from December 2000 to December 2001. From September 2000 to December 2000, Mr. Harshman served as Vice President, Controller and Acting Chief Financial Officer of Allegheny Technologies Inc. Previously, he served as Vice President for Investor Relations and Corporate Communications at Allvac since July 1998, and served as Senior Vice President for Finance and Administration from 1995. He has been a Director of Ameren Corporation since June 2013. He has been Vice Chair of Allegheny Conference On Community Development since January 01, 2014. He serves as vice chairman of the board of trustees at Robert Morris University. He is a Member of the board of directors of the National Association of Manufacturers. He is a member of the board of directors of the Laurel Highlands Council, Boy Scouts of America (Greater Pittsburgh Area). He is also a member of the Chairman's Council of the Pittsburgh Symphony Orchestra and the Pittsburgh Cultural Trust Board of Trustees. He was a Director of the Ethics and Compliance Officer Association. He has received many accolades, including being named one of the Most Influential People in Business of 2011 by the Pittsburgh Post-Gazette. He was also honored with the Best CFO Award in 2008 by Institutional Investor and named 2008 CFO of the Year (public company category) by the Pittsburgh Business Times. He is active in various charitable and Civic Organizations including the United Way and the Challenger Baseball Program for children with special needs. Mr. Harshman achieved his Certified Public Accountant's certificate in 1985 and holds a Bachelor of Science degree from Robert Morris University.","1000 Six PPG PlacePittsburgh, Pennsylvania 15222United States",Johns Manville Corporation|Ameren Corporation|ATI Ladish LLC|Robert Morris University|ATI Wah Chang Inc.,Male,,,,Allegheny Technologies - Executive Vice President, Finance - ts_bot - Employment tenure | Allegheny Technologies - Chief Financial Officer - ts_bot - Employment tenure | ,
